SectionName,SectionTimeLimitMinutes,QuestionUniqueID,QuestionNumberInSection,PassageOrSetID,PassageOrSetContent,QuestionPrompt,OptionAText,OptionBText,OptionCText,OptionDText,OptionAValue,OptionBValue,OptionCValue,OptionDValue,CorrectAnswerValue,QuestionType,Topic,SubTopic,DifficultyLevelPredicted,ConceptTested,DetailedTags,IsTITA,SetID,CognitiveSkillLevel,SolutionExplanation
VARC,40,Q18,18,VA_OOO_ArtInterpretation,"1. The artist's intention, while often discussed, may not be the sole determinant of a work's meaning.
2. Each viewer brings a unique set of experiences and perspectives, leading to diverse interpretations.
3. Art critics often provide scholarly frameworks that can enrich the public's understanding.
4. The historical and cultural context in which a piece of art was created significantly shapes its initial reception.
5. Ultimately, the most compelling art resonates on multiple levels, transcending singular explanations.","Five jumbled sentences are given below. Four of them can be put together to form a coherent paragraph. Identify the odd one out.

The artist's intention, while often discussed, may not be the sole determinant of a work's meaning.

Each viewer brings a unique set of experiences and perspectives, leading to diverse interpretations.

Art critics often provide scholarly frameworks that can enrich the public's understanding.

The historical and cultural context in which a piece of art was created significantly shapes its initial reception.

Ultimately, the most compelling art resonates on multiple levels, transcending singular explanations.
Type in the number of the odd sentence.",,,,,,,,,3,TITA,VA,Odd One Out (Sentence Exclusion),Hard,Coherence & Theme Identification / Direct Application,"question_id:Q18, section:VARC, question_type:TITA, topic:VA, sub_topic:Odd One Out (Sentence Exclusion), concept_tested:Coherence & Theme Identification / Direct Application, difficulty_level:Hard, is_tita:true, set_id:MockSet1_VARC, unique_mock_id:8f9a0c1b2",True,MockSet1_VARC,Analyzing,"Sentences 1, 2, 4, and 5 all discuss factors that contribute to the interpretation and reception of art from different perspectives (artist's intention, viewer's experience, historical context, multifaceted resonance). Sentence 3, ""Art critics often provide scholarly frameworks that can enrich the public's understanding,"" introduces the role of art critics, which, while related to art, is a specific external input rather than an inherent aspect of the art's creation or its direct encounter by a viewer/context as discussed by the other sentences that focus more on the work itself and its immediate interpretative sphere. The flow of 1, 4, 2, 5 creates a coherent discussion about the multifaceted nature of artistic meaning and reception.
Coherent paragraph sequence could be: 1 introduces the artist's intention. 4 adds the historical context. 2 brings in the viewer's role. 5 concludes on the multifaceted nature of compelling art. Sentence 3 talks about the role of critics, which is slightly tangential to the core theme of how meaning is derived from the artwork itself and its immediate context/viewer interaction."
VARC,40,Q19,19,VA_PS_EchoChambers,"Paragraph: The increasing prevalence of echo chambers in online discourse poses a significant challenge to informed public debate. Algorithmic curation on social media platforms tends to reinforce existing beliefs by selectively presenting information that aligns with a user's prior views, while filtering out dissenting opinions. This intellectual isolation can lead to heightened polarization, a diminished capacity for empathy towards differing perspectives, and an increased susceptibility to misinformation, as individuals are less likely to encounter corrective information or engage in critical self-reflection. Consequently, the shared factual basis necessary for constructive dialogue erodes.",The passage given below is followed by four alternative summaries. Choose the option that best captures the essence of the passage.,Social media algorithms are solely responsible for the spread of misinformation and political polarization.,"Echo chambers limit exposure to diverse viewpoints, making individuals more entrenched in their beliefs and less open to constructive debate.",The primary danger of online echo chambers is the reduction in critical self-reflection among users.,"To improve public debate, social media platforms must abandon algorithmic curation entirely.",A,B,C,D,B,MCQ,VA,Para Summary (Essence of the Paragraph),Medium,Main Idea Identification / Direct Application,"question_id:Q19, section:VARC, question_type:MCQ, topic:VA, sub_topic:Para Summary (Essence of the Paragraph), concept_tested:Main Idea Identification / Direct Application, difficulty_level:Medium, is_tita:false, set_id:MockSet1_VARC, unique_mock_id:8f9a0c1b2",False,MockSet1_VARC,Analyzing,"The paragraph describes how algorithms ""reinforce existing beliefs by selectively presenting information... while filtering out dissenting opinions,"" leading to ""intellectual isolation,"" ""heightened polarization,"" and an erosion of ""shared factual basis necessary for constructive dialogue."" Option B accurately captures this core idea.
Option A is too strong (""solely responsible"") and an overstatement.
Option C focuses on only one consequence (""critical self-reflection""), while the paragraph lists several.
Option D proposes a solution, which is not the main point of the descriptive paragraph."
VARC,40,Q20,20,VA_PS_Stoicism,"Paragraph: Stoic philosophy, originating in ancient Greece, offers enduring wisdom on navigating life's adversities. At its core, Stoicism teaches the development of self-control and fortitude as a means of overcoming destructive emotions and achieving inner peace. It emphasizes distinguishing between what we can control—our thoughts, judgments, and actions—and what we cannot—external events and the actions of others. By focusing our energy on our own responses and accepting fate with equanimity, Stoics believed one could live a virtuous and fulfilling life, irrespective of external circumstances.",The passage given below is followed by four alternative summaries. Choose the option that best captures the essence of the passage.,Stoicism is primarily a fatalistic philosophy that encourages passive acceptance of all life events.,The main goal of Stoic philosophy is to eliminate all emotions to achieve a state of detached apathy.,Stoicism advocates for achieving tranquility by concentrating on one's own responses to events and accepting what is beyond personal control.,Ancient Greek philosophies like Stoicism are no longer relevant to modern life's challenges.,A,B,C,D,C,MCQ,VA,Para Summary (Essence of the Paragraph),Medium,Main Idea Identification / Direct Application,"question_id:Q20, section:VARC, question_type:MCQ, topic:VA, sub_topic:Para Summary (Essence of the Paragraph), concept_tested:Main Idea Identification / Direct Application, difficulty_level:Medium, is_tita:false, set_id:MockSet1_VARC, unique_mock_id:8f9a0c1b2",False,MockSet1_VARC,Analyzing,"The paragraph states Stoicism ""emphasizes distinguishing between what we can control—our thoughts, judgments, and actions—and what we cannot—external events..."" and ""By focusing our energy on our own responses and accepting fate with equanimity, Stoics believed one could live a virtuous and fulfilling life..."" Option C accurately summarizes this central tenet.
Option A misinterprets ""accepting fate with equanimity"" as purely passive; Stoicism also emphasizes self-control and virtuous action.
Option B is an overstatement; it's about overcoming *destructive* emotions, not eliminating all emotions.
Option D is an opinion not expressed in the paragraph, which focuses on describing Stoicism."
VARC,40,Q21,21,VA_SP_Neuroplasticity,"Paragraph: The concept of ""neuroplasticity"" refers to the brain's remarkable ability to reorganize itself by forming new neural connections throughout life. (1) This adaptability allows the neurons (nerve cells) in the brain to compensate for injury and disease and to adjust their activities in response to new situations or to changes in their environment. (2) For instance, learning a new skill, such as playing a musical instrument or speaking a foreign language, can lead to significant structural and functional changes in the brain. (3) These changes are not limited to early development; they can occur at any age. (4)
Sentence to be placed: ""Consequently, the adage 'you can't teach an old dog new tricks' is increasingly being challenged by neuroscientific evidence.""","A paragraph is given with four numbered blanks. A sentence is provided below the paragraph. Identify the blank number where the given sentence fits most logically and coherently.
Paragraph: The concept of ""neuroplasticity"" refers to the brain's remarkable ability to reorganize itself by forming new neural connections throughout life. (1) This adaptability allows the neurons (nerve cells) in the brain to compensate for injury and disease and to adjust their activities in response to new situations or to changes in their environment. (2) For instance, learning a new skill, such as playing a musical instrument or speaking a foreign language, can lead to significant structural and functional changes in the brain. (3) These changes are not limited to early development; they can occur at any age. (4)
Sentence to be placed: ""Consequently, the adage 'you can't teach an old dog new tricks' is increasingly being challenged by neuroscientific evidence.""",(1),(2),(3),(4),A,B,C,D,D,MCQ,VA,Para Completion (Fill in the Blank / Last Sentence),Medium,Contextual Fit & Logical Extension / Direct Application,"question_id:Q21, section:VARC, question_type:MCQ, topic:VA, sub_topic:Para Completion (Fill in the Blank / Last Sentence), concept_tested:Contextual Fit & Logical Extension / Direct Application, difficulty_level:Medium, is_tita:false, set_id:MockSet1_VARC, unique_mock_id:8f9a0c1b2",False,MockSet1_VARC,Applying,"Sentence (3) states that neuroplastic changes ""can occur at any age."" The sentence to be placed, ""Consequently, the adage 'you can't teach an old dog new tricks' is increasingly being challenged by neuroscientific evidence,"" logically follows this assertion. The word ""Consequently"" signals a result or conclusion drawn from the immediately preceding statement that changes are not limited to early development and can occur at any age. This directly challenges the old adage. Placing it after (3) makes the flow perfect, as it concludes the point about lifelong plasticity."
VARC,40,Q22,22,VA_SP_RationalityEconomics,"Paragraph: Early economic theories often assumed perfect rationality in decision-making. (1) However, empirical evidence consistently shows that human choices are frequently influenced by cognitive biases, emotions, and social factors. (2) This discrepancy led to the development of behavioral economics, which integrates psychological insights into economic models. (3) It does not seek to entirely replace traditional economics but rather to enrich it by providing a more realistic understanding of human behavior. (4)
Sentence to be placed: ""Such models posited that individuals make choices to maximize their utility, equipped with complete information and flawless processing capabilities.""","A paragraph is given with four numbered blanks. A sentence is provided below the paragraph. Identify the blank number where the given sentence fits most logically and coherently.
Paragraph: Early economic theories often assumed perfect rationality in decision-making. (1) However, empirical evidence consistently shows that human choices are frequently influenced by cognitive biases, emotions, and social factors. (2) This discrepancy led to the development of behavioral economics, which integrates psychological insights into economic models. (3) It does not seek to entirely replace traditional economics but rather to enrich it by providing a more realistic understanding of human behavior. (4)
Sentence to be placed: ""Such models posited that individuals make choices to maximize their utility, equipped with complete information and flawless processing capabilities.""",(1),(2),(3),(4),A,B,C,D,A,MCQ,VA,Para Completion (Fill in the Blank / Last Sentence),Medium,Contextual Fit & Logical Extension / Direct Application,"question_id:Q22, section:VARC, question_type:MCQ, topic:VA, sub_topic:Para Completion (Fill in the Blank / Last Sentence), concept_tested:Contextual Fit & Logical Extension / Direct Application, difficulty_level:Medium, is_tita:false, set_id:MockSet1_VARC, unique_mock_id:8f9a0c1b2",False,MockSet1_VARC,Applying,"The paragraph starts with a general statement: ""Early economic theories often assumed perfect rationality in decision-making."" The sentence to be placed, ""Such models posited that individuals make choices to maximize their utility, equipped with complete information and flawless processing capabilities,"" elaborates on *how* these early theories assumed perfect rationality by describing the characteristics of those models. It fits perfectly after the opening sentence (i.e., in blank (1)) to provide more detail about these ""early economic theories"" before the paragraph contrasts this with empirical evidence in the sentence that would follow it."
VARC,40,Q23,23,VA_PJ_InsectApocalypse,"1. This decline is attributed to a combination of factors, including habitat loss, climate change, and the widespread use of pesticides.
2. Recent studies indicate a significant and alarming decline in global insect populations, a phenomenon often dubbed the ""insect apocalypse.""
3. The consequences of this loss are far-reaching, as insects play crucial roles in pollination, nutrient cycling, and as a food source for other animals.
4. Conservation efforts are therefore urgently needed, focusing on habitat restoration, sustainable agricultural practices, and reduced pesticide dependence.","The four sentences (labelled 1, 2, 3, 4) given below, when properly sequenced, form a coherent paragraph. Decide on the proper order for the sentences and key in this sequence of four numbers as your answer.",,,,,,,,,2134,TITA,VA,Para Jumbles (Sentence Rearrangement),Medium,Coherence & Logical Flow / Direct Application,"question_id:Q23, section:VARC, question_type:TITA, topic:VA, sub_topic:Para Jumbles (Sentence Rearrangement), concept_tested:Coherence & Logical Flow / Direct Application, difficulty_level:Medium, is_tita:true, set_id:MockSet1_VARC, unique_mock_id:8f9a0c1b2",True,MockSet1_VARC,Applying,"2. Introduces the core problem: ""Recent studies indicate a significant and alarming decline in global insect populations..."" This is a good introductory sentence.
1. Elaborates on the cause: ""This decline is attributed to..."" The pronoun ""This decline"" clearly refers to the decline mentioned in sentence 2.
3. Details the effects: ""The consequences of this loss are far-reaching..."" ""this loss"" refers back to the decline, explaining its impact.
4. Proposes a solution: ""Conservation efforts are therefore urgently needed..."" The word ""Therefore"" signals a conclusion or recommended action based on the previously stated problem, its causes, and consequences. The logical flow is Problem -> Cause -> Consequence -> Solution."
VARC,40,Q24,24,VA_PJ_RousseauLiberty,"1. He argued that true freedom lies not in the absence of external constraints alone, but in self-mastery and rational self-governance.
2. For Rousseau, this ""civil liberty"" was an exchange for the ""natural liberty"" of the state of nature, but one that ultimately offered greater moral and intellectual development.
3. Jean-Jacques Rousseau, in The Social Contract, presents a complex notion of liberty.
4. This self-mastery is achieved by obeying laws that one prescribes for oneself as part of a collective sovereign, the general will.","The four sentences (labelled 1, 2, 3, 4) given below, when properly sequenced, form a coherent paragraph. Decide on the proper order for the sentences and key in this sequence of four numbers as your answer.",,,,,,,,,3142,TITA,VA,Para Jumbles (Sentence Rearrangement),Hard,Coherence & Logical Flow / Direct Application,"question_id:Q24, section:VARC, question_type:TITA, topic:VA, sub_topic:Para Jumbles (Sentence Rearrangement), concept_tested:Coherence & Logical Flow / Direct Application, difficulty_level:Hard, is_tita:true, set_id:MockSet1_VARC, unique_mock_id:8f9a0c1b2",True,MockSet1_VARC,Applying,"3. Introduces the thinker and concept: ""Jean-Jacques Rousseau, in The Social Contract, presents a complex notion of liberty."" This is the best opening sentence.
1. Elaborates on Rousseau's argument: ""He argued that true freedom lies..."" The pronoun ""He"" refers to Rousseau introduced in sentence 3.
4. Explains a key term from sentence 1: ""This self-mastery is achieved by..."" ""This self-mastery"" directly links to ""self-mastery"" mentioned in sentence 1.
2. Provides further context and concludes the idea: ""For Rousseau, this 'civil liberty' was an exchange..."" ""this 'civil liberty'"" refers to the type of freedom developed through self-mastery and adherence to self-prescribed laws, as detailed in sentences 1 and 4. It contrasts this with 'natural liberty' and highlights its benefits."
