SectionName,SectionTimeLimitMinutes,QuestionUniqueID,QuestionNumberInSection,PassageOrSetID,PassageOrSetContent,QuestionPrompt,OptionAText,OptionBText,OptionCText,OptionDText,OptionAValue,OptionBValue,OptionCValue,OptionDValue,CorrectAnswerValue,QuestionType,Topic,SubTopic,DifficultyLevelPredicted,ConceptTested,DetailedTags,IsTITA,SetID,CognitiveSkillLevel,SolutionExplanation
VARC,40,Q16,16,P4_BerlinLiberty,"Isaiah Berlin’s 1958 lecture, ""Two Concepts of Liberty,"" remains a seminal text in modern political philosophy, articulating a crucial distinction between ""negative"" and ""positive"" freedom that continues to shape debates about the nature and limits of individual liberty and state authority. Berlin, wary of the historical trajectory of utopian ideals turning tyrannical, sought to delineate these concepts with care, highlighting the potential perils he associated primarily with an uncritical embrace of positive liberty.

Negative liberty, in Berlin’s formulation, is essentially ""freedom from"": freedom from interference, coercion, or constraint imposed by other people or by the state. It defines an area within which an individual can act unobstructed. The extent of one's negative liberty is determined by how many doors are open, how wide they are, and how unmolested one is in pursuing one's chosen paths within that domain. This concept aligns with classical liberal thought, emphasizing the importance of individual rights, limited government, and the protection of a private sphere where state intervention is minimized. For Berlin, a certain minimum area of personal freedom was sacrosanct, indispensable for the development of human faculties and the pursuit of diverse, often conflicting, human ends.

Positive liberty, conversely, is ""freedom to"": the freedom to be one's own master, to act according to reason, to achieve self-realization or self-determination. It is concerned not merely with the absence of external obstacles but with the presence of conditions that enable individuals to pursue their ""true"" or ""higher"" selves. While this aspiration for self-mastery is intuitively appealing, Berlin harbored deep suspicions about its potential political misapplication. He argued that the notion of a ""true self"" could be easily co-opted by those in power, who might then claim to know what is best for individuals better than the individuals themselves. This could lead to a paternalistic, or even authoritarian, state justifying coercion in the name of helping citizens achieve their ""real"" freedom, effectively forcing them to be free. This, for Berlin, was the slippery slope from an ideal of individual self-direction to collective control and oppression.

Berlin did not outright reject positive liberty as a personal ideal but was profoundly cautious about its institutionalization as a political goal, especially when it involved a singular, monolithic conception of the human good. He feared that the pursuit of a collective positive liberty could readily override individual negative liberties, sacrificing the actual, diverse freedoms of individuals at the altar of an abstract, imposed ideal. His analysis serves as a persistent reminder of the complexities inherent in defining freedom and the constant vigilance required to protect it from both overt oppression and well-intentioned, but ultimately dangerous, paternalism.",The author's tone in discussing Berlin's analysis of positive liberty can best be described as:,dismissive and derisive.,unreservedly laudatory.,"neutral and descriptive, acknowledging its potential for misapplication as Berlin saw it.",overtly hostile towards any notion of self-mastery.,A,B,C,D,C,MCQ,RC,RC Passage Genre: Abstract & Philosophical,Medium,Tone / Attitude of the Author,question_id: Q16; section: VARC; question_type: MCQ; topic: RC; sub_topic: RC Passage Genre: Abstract & Philosophical; concept_tested: Tone / Attitude of the Author; difficulty_level: Medium; is_tita: false; set_id: MockSet1_VARC; unique_mock_id: 8c1f7a9b3,False,MockSet1_VARC,Analysis,"C) neutral and descriptive, acknowledging its potential for misapplication as Berlin saw it.
The passage explains Berlin's concept of positive liberty and his ""deep suspicions about its potential political misapplication"" (para 3) and that he ""did not outright reject positive liberty as a personal ideal but was profoundly cautious about its institutionalization"" (para 4). The tone is one of explaining Berlin's views and concerns rather than being dismissive, laudatory, or hostile itself.
A is too negative.
B is too positive; the passage highlights Berlin's *concerns*.
D is too strong and misrepresents Berlin's nuanced view."
VARC,40,Q17,17,VA_OOO1,"1. The intricate dance of supply and demand dictates prices in a free market.
2. Historical analysis often reveals long-term economic cycles that elude short-term observation.
3. Consumer confidence, a key psychological metric, significantly influences spending patterns.
4. Government interventions, such as subsidies or taxes, can distort these natural market mechanisms.
5. Ultimately, the equilibrium price is where the quantity supplied meets the quantity demanded.","Five jumbled sentences are given below. Four of them can be put together to form a coherent paragraph. Identify the odd one out.
Type your answer in the text box.",,,,,,,,,2,TITA,VA,Odd One Out (Sentence Exclusion),Medium,Coherence & Theme Identification / Direct Application,question_id: Q17; section: VARC; question_type: TITA; topic: VA; sub_topic: Odd One Out (Sentence Exclusion); concept_tested: Coherence & Theme Identification / Direct Application; difficulty_level: Medium; is_tita: true; set_id: MockSet1_VARC; unique_mock_id: 8c1f7a9b3,True,MockSet1_VARC,Analysis,"The sentences 1, 3, 4, and 5 discuss concepts related to market economics and price determination: supply and demand (1), consumer confidence influencing spending (3), government intervention distorting market mechanisms (4), and equilibrium price (5). Sentence 2, ""Historical analysis often reveals long-term economic cycles that elude short-term observation,"" talks about long-term economic cycles from a historical analysis perspective, which is a broader macro-economic topic and different from the micro-economic mechanics of price setting discussed by the other sentences. The coherent paragraph would likely be 1-5-4-3 or a similar order focusing on market dynamics. 1, 5 define basics, 4 talks about distortion, 3 adds a psychological factor. Sentence 2 is about a different scale and methodology of economic study.
The outlier sentence is 2."
VARC,40,Q18,18,VA_OOO2,"1. This meticulous approach ensures that the final translation is not only accurate but also culturally resonant.
2. Literary translation is far more than substituting words from one language to another.
3. Translators must capture the nuances of style, tone, and rhythm inherent in the original text.
4. Many a literary masterpiece has gained a new lease of life in a different tongue through skilled translation.
5. It involves a deep understanding of both source and target cultures, as well as literary conventions.","Five jumbled sentences are given below. Four of them can be put together to form a coherent paragraph. Identify the odd one out.
Type your answer in the text box.",,,,,,,,,4,TITA,VA,Odd One Out (Sentence Exclusion),Medium,Coherence & Theme Identification / Direct Application,question_id: Q18; section: VARC; question_type: TITA; topic: VA; sub_topic: Odd One Out (Sentence Exclusion); concept_tested: Coherence & Theme Identification / Direct Application; difficulty_level: Medium; is_tita: true; set_id: MockSet1_VARC; unique_mock_id: 8c1f7a9b3,True,MockSet1_VARC,Analysis,"Sentences 2, 5, 3, and 1 describe the process and qualities of literary translation. Sentence 2 introduces literary translation as more than word substitution. Sentence 5 elaborates on what it involves (understanding cultures, literary conventions). Sentence 3 details what translators must capture (nuances). Sentence 1 describes the outcome of such a meticulous approach (accurate, culturally resonant). Sentence 4, ""Many a literary masterpiece has gained a new lease of life in a different tongue through skilled translation,"" is a statement about the impact or achievement of translation, rather than the process or nature of translation itself, which is the theme of 2, 5, 3, and 1.
The outlier sentence is 4."
VARC,40,Q19,19,VA_PS1,"The proliferation of digital archives and online databases has democratized access to historical information on an unprecedented scale. Researchers and laypersons alike can now explore vast collections that were once confined to physical libraries or accessible only to a privileged few. However, this digital abundance also presents new challenges: the sheer volume can be overwhelming, issues of data integrity and provenance require careful scrutiny, and the digital divide means that access is not yet universal. Navigating this new landscape requires critical digital literacy skills.",The paragraph given below is followed by four summaries. Choose the option that best captures the essence of the paragraph.,"Digital archives are primarily beneficial for professional historians, offering them more resources than ever before.","While digital access to historical information has vastly increased, it brings challenges like information overload, data verification, and unequal access, necessitating digital literacy.","The main problem with digital archives is the digital divide, which prevents many from accessing historical information.",The overwhelming volume of data in digital archives makes them less useful than traditional physical libraries for serious research.,A,B,C,D,B,MCQ,VA,Para Summary (Essence of the Paragraph),Medium,Main Idea Identification / Direct Application,question_id: Q19; section: VARC; question_type: MCQ; topic: VA; sub_topic: Para Summary (Essence of the Paragraph); concept_tested: Main Idea Identification / Direct Application; difficulty_level: Medium; is_tita: false; set_id: MockSet1_VARC; unique_mock_id: 8c1f7a9b3,False,MockSet1_VARC,Comprehension,"B) While digital access to historical information has vastly increased, it brings challenges like information overload, data verification, and unequal access, necessitating digital literacy.
This summary captures the dual nature presented in the paragraph: the benefit of democratized access (""unprecedented scale,"" ""explore vast collections"") and the challenges (""sheer volume can be overwhelming,"" ""data integrity and provenance require careful scrutiny,"" ""digital divide,"" ""requires critical digital literacy skills"").
A is too narrow, focusing only on professional historians and benefits.
C focuses only on one challenge (digital divide) as the ""main problem.""
D makes a comparative judgment (""less useful than traditional libraries"") not explicitly stated and dismisses the utility due to volume."
VARC,40,Q20,20,VA_PS2,"Urban heat islands (UHIs) occur when cities experience much warmer temperatures than nearby rural areas. This phenomenon is primarily caused by the modification of land surfaces: materials like concrete and asphalt absorb and retain more solar radiation than natural landscapes. Additionally, waste heat from buildings, industrial processes, and vehicles contributes to the effect. UHIs can have significant consequences, including increased energy demand for cooling, aggravated air pollution, and heat-related health problems for urban residents.",The paragraph given below is followed by four summaries. Choose the option that best captures the essence of the paragraph.,Urban heat islands are solely caused by heat-retaining construction materials and have minimal impact on urban life.,"The primary cause of urban heat islands is industrial waste heat, and their main effect is on air quality.","Urban heat islands, resulting from heat-absorbent urban surfaces and waste heat, lead to higher city temperatures with consequences like increased energy use and health issues.","Planting more trees is the only effective solution to mitigate the urban heat island effect, which mainly causes discomfort.",A,B,C,D,C,MCQ,VA,Para Summary (Essence of the Paragraph),Medium,Main Idea Identification / Direct Application,question_id: Q20; section: VARC; question_type: MCQ; topic: VA; sub_topic: Para Summary (Essence of the Paragraph); concept_tested: Main Idea Identification / Direct Application; difficulty_level: Medium; is_tita: false; set_id: MockSet1_VARC; unique_mock_id: 8c1f7a9b3,False,MockSet1_VARC,Comprehension,"C) Urban heat islands, resulting from heat-absorbent urban surfaces and waste heat, lead to higher city temperatures with consequences like increased energy use and health issues.
This summary accurately captures the cause (modification of land surfaces, waste heat) and key consequences (increased energy demand, air pollution, health problems) mentioned in the paragraph.
A is inaccurate; it states ""solely caused by heat-retaining construction materials"" and ""minimal impact,"" both contradicted by the paragraph.
B is inaccurate; it states ""primary cause is industrial waste heat"" (paragraph says land surface modification is primary) and limits effects to air quality.
D focuses on a solution not mentioned and downplays the severity of effects."
VARC,40,Q21,21,VA_SP1,"Scientific inquiry is fundamentally a process of iterative refinement. (1) _____. Initial hypotheses are often broad and may require substantial modification as new evidence comes to light. (2) _____. This cycle of proposing, testing, and revising is central to the advancement of knowledge. (3) _____. Therefore, a hallmark of good scientific practice is the willingness to abandon or alter long-held beliefs in the face of compelling contradictory data. (4) _____.","A paragraph is given with four numbered blanks. A sentence is provided below the paragraph. Identify the blank number where the given sentence fits most logically and coherently.

Sentence: Experiments are designed to test these hypotheses, and their results can either support or challenge the original propositions.",(1),(2),(3),(4),A,B,C,D,B,MCQ,VA,Para Completion (Fill in the Blank / Last Sentence),Medium,Contextual Fit & Logical Extension / Direct Application,question_id: Q21; section: VARC; question_type: MCQ; topic: VA; sub_topic: Para Completion (Fill in the Blank / Last Sentence); concept_tested: Contextual Fit & Logical Extension / Direct Application; difficulty_level: Medium; is_tita: false; set_id: MockSet1_VARC; unique_mock_id: 8c1f7a9b3,False,MockSet1_VARC,Analysis,"B) (2)
The paragraph discusses the iterative nature of scientific inquiry. The sentence before blank (2) mentions 'Initial hypotheses'. The provided sentence, ""Experiments are designed to test these hypotheses, and their results can either support or challenge the original propositions,"" logically follows the mention of hypotheses ('these hypotheses' refers to 'Initial hypotheses') and describes the testing phase. The sentence after blank (2) then refers to 'This cycle of proposing, testing, and revising', which perfectly summarizes the sequence of hypotheses -> experiments -> results -> revision.
Blank (1) is too early as 'Initial hypotheses' are introduced after it.
Blank (3) is too late; the cycle is already being summarized.
Blank (4) is at the very end, after a concluding thought on scientific practice."
VARC,40,Q22,22,VA_SP2,"The concept of 'critical periods' in developmental psychology suggests that there are specific windows of time during which an organism is optimally sensitive to certain environmental stimuli for learning or development. (1) _____. For example, the acquisition of a first language seems to be most effective during early childhood. (2) _____. If exposure to language does not occur during this sensitive phase, the ability to acquire language fluently and naturally can be significantly impaired. (3) _____. (4) _____, though the boundaries and strictness of these periods are subjects of ongoing research.","A paragraph is given with four numbered blanks. A sentence is provided below the paragraph. Identify the blank number where the given sentence fits most logically and coherently.

Sentence: This principle applies to various domains, including sensory development, motor skills, and social learning.",(1),(2),(3),(4),A,B,C,D,A,MCQ,VA,Para Completion (Fill in the Blank / Last Sentence),Medium,Contextual Fit & Logical Extension / Direct Application,question_id: Q22; section: VARC; question_type: MCQ; topic: VA; sub_topic: Para Completion (Fill in the Blank / Last Sentence); concept_tested: Contextual Fit & Logical Extension / Direct Application; difficulty_level: Medium; is_tita: false; set_id: MockSet1_VARC; unique_mock_id: 8c1f7a9b3,False,MockSet1_VARC,Analysis,"A) (1)
The first sentence introduces the concept of 'critical periods.' The given sentence, ""This principle applies to various domains, including sensory development, motor skills, and social learning,"" serves to broaden the applicability of the 'critical periods' concept ('This principle' refers to 'critical periods') immediately after its introduction and before specific examples (like language acquisition) are given. This provides a general scope before delving into a particular instance.
Blank (2) would interrupt the flow of the language acquisition example.
Blank (3) is after the consequence of missing the language acquisition window has been explained.
Blank (4) is at the end, which is a less effective placement than immediately after the concept's introduction to establish its breadth."
VARC,40,Q23,23,VA_SS1,"1. This approach, however, often overlooks the systemic barriers and ingrained biases that can impede genuine individual advancement regardless of effort.
2. The narrative of individual responsibility is deeply embedded in many societies, emphasizing personal effort and determination as the primary drivers of success.
3. Consequently, a more nuanced understanding acknowledges the interplay between personal agency and structural factors.
4. It suggests that anyone can achieve their goals if they simply work hard enough.","The four sentences (labelled 1, 2, 3, 4) given below, when properly sequenced, form a coherent paragraph. Decide on the proper order and key in the sequence of numbers as your answer.
Type your answer in the text box.",,,,,,,,,2413,TITA,VA,Para Jumbles (Sentence Rearrangement),Medium,Coherence & Logical Flow / Direct Application,question_id: Q23; section: VARC; question_type: TITA; topic: VA; sub_topic: Para Jumbles (Sentence Rearrangement); concept_tested: Coherence & Logical Flow / Direct Application; difficulty_level: Medium; is_tita: true; set_id: MockSet1_VARC; unique_mock_id: 8c1f7a9b3,True,MockSet1_VARC,Analysis,"Sentence 2 introduces the ""narrative of individual responsibility"" and its emphasis. This is a good opening sentence.
Sentence 4 elaborates on what this narrative suggests (""It suggests that anyone can achieve their goals if they simply work hard enough""). 'It' refers to the narrative mentioned in S2.
Sentence 1 then offers a critique of ""This approach"" (referring to the narrative described in S2 and S4), stating it overlooks systemic barriers. The 'however' signals a contrast.
Sentence 3 provides a conclusion or a more nuanced understanding (""Consequently, a more nuanced understanding..."") that follows from the introduction of the narrative and its critique, acknowledging both personal agency and structural factors.
Thus, the sequence is 2-4-1-3."
VARC,40,Q24,24,VA_SS2,"1. Its unique chemical properties allow it to form stable bonds with many other elements, including itself.
2. This versatility is fundamental to the complexity and diversity of life on Earth.
3. Carbon is the cornerstone of organic chemistry.
4. This results in a vast array of carbon-based molecules, from simple methane to complex proteins and DNA.","The four sentences (labelled 1, 2, 3, 4) given below, when properly sequenced, form a coherent paragraph. Decide on the proper order and key in the sequence of numbers as your answer.
Type your answer in the text box.",,,,,,,,,3142,TITA,VA,Para Jumbles (Sentence Rearrangement),Medium,Coherence & Logical Flow / Direct Application,question_id: Q24; section: VARC; question_type: TITA; topic: VA; sub_topic: Para Jumbles (Sentence Rearrangement); concept_tested: Coherence & Logical Flow / Direct Application; difficulty_level: Medium; is_tita: true; set_id: MockSet1_VARC; unique_mock_id: 8c1f7a9b3,True,MockSet1_VARC,Analysis,"Sentence 3 makes a general, introductory statement: ""Carbon is the cornerstone of organic chemistry."" This is a strong opening sentence.
Sentence 1 explains *why* carbon is the cornerstone, referring to 'Its' (Carbon's) unique chemical properties.
Sentence 4 describes the result of these chemical properties ('This results in...'), detailing the vast array of molecules formed.
Sentence 2 provides a concluding statement about the significance of 'This versatility' (referring to the ability to form many molecules), linking it to the complexity of life.
Thus, the sequence is 3-1-4-2."
