SectionName,SectionTimeLimitMinutes,QuestionUniqueID,QuestionNumberInSection,PassageOrSetID,PassageOrSetContent,QuestionPrompt,OptionAText,OptionBText,OptionCText,OptionDText,OptionAValue,OptionBValue,OptionCValue,OptionDValue,CorrectAnswerValue,QuestionType,Topic,SubTopic,DifficultyLevelPredicted,ConceptTested,DetailedTags,IsTITA,SetID,CognitiveSkillLevel,SolutionExplanation
VARC,40,Q6,6,P2_Emergent,"Emergent behavior is a captivating phenomenon observed across diverse complex systems, from the intricate organization of ant colonies to the synchronized movements of starling murmurations and the complex functionalities of the human brain. It refers to the way complex, high-level patterns and behaviors arise from the collective actions of many individual agents, each following relatively simple rules and interacting primarily with its local neighbors, without any central control or overarching blueprint dictating the global outcome. The sophisticated architecture of a termite mound, for instance, is not the product of a master architect termite, but the cumulative result of countless termites responding to local pheromonal cues and environmental stimuli.

This ""bottom-up"" organization contrasts sharply with traditional reductionist approaches, which seek to understand a system by dissecting it into its constituent parts and studying them in isolation. While reductionism has been remarkably successful in many scientific domains, it often falls short in explaining systems where the interactions between components are as crucial as the components themselves. In emergent systems, the whole is truly more than the sum of its parts; the macroscopic behavior cannot be readily predicted or understood by merely analyzing the individual agents. The characteristic flocking patterns of birds, for example, can be simulated with models where each bird follows simple rules like maintaining a minimum distance from others, matching velocity with neighbors, and moving towards the perceived center of the group. No single bird ""knows"" the flock's overall shape or direction, yet a coherent, adaptive group behavior emerges.

The study of emergence has profound implications. In biology, it helps explain how complex life forms can arise from simpler precursors and how ecosystems maintain stability. In computer science, it underpins concepts in artificial life and swarm robotics, where decentralized systems of simple robots can collectively perform complex tasks. Understanding emergence can also offer insights into social phenomena, like the formation of public opinion or the spontaneous organization of markets. However, a key challenge in studying emergence is its inherent unpredictability at the micro-level; while we can identify the conditions conducive to emergent phenomena, forecasting the precise nature or timing of the emergent patterns often remains elusive. This unpredictability stems from the non-linear interactions and feedback loops that characterize these systems.

Moreover, the concept of emergence forces us to reconsider notions of control and design. Instead of top-down instruction, influencing emergent systems often requires subtle interventions at the level of individual agent rules or their interaction environment. This paradigm shift is critical for tackling complex contemporary challenges, from managing urban growth to mitigating the spread of epidemics, where centralized solutions may be ineffective or counterproductive. The beauty and power of emergence lie in its capacity to generate novelty, adaptation, and resilience from simplicity.",It can be inferred from the passage that a purely reductionist approach would likely struggle to explain:,the chemical composition of a single termite's pheromones.,the rules governing an individual bird's response to its immediate neighbors in a flock.,"the coordinated, hive-mind-like foraging strategy of an entire ant colony.",the genetic makeup of individual cells within a complex organism.,A,B,C,D,C,MCQ,RC,RC Passage Genre: Science & Technology,Medium,Inference / Implied Meaning,question_id: Q6; section: VARC; question_type: MCQ; topic: RC; sub_topic: RC Passage Genre: Science & Technology; concept_tested: Inference / Implied Meaning; difficulty_level: Medium; is_tita: false; set_id: MockSet1_VARC; unique_mock_id: 8c1f7a9b3,False,MockSet1_VARC,Analysis,"C) the coordinated, hive-mind-like foraging strategy of an entire ant colony.
Paragraph 2 states that in emergent systems, ""the macroscopic behavior cannot be readily predicted or understood by merely analyzing the individual agents."" A colony's foraging strategy is a macroscopic, collective behavior. Reductionism, which studies parts in isolation, would struggle with this.
A, B, and D refer to individual components or rules governing them, which reductionism is suited to analyze."
VARC,40,Q7,7,P2_Emergent,"Emergent behavior is a captivating phenomenon observed across diverse complex systems, from the intricate organization of ant colonies to the synchronized movements of starling murmurations and the complex functionalities of the human brain. It refers to the way complex, high-level patterns and behaviors arise from the collective actions of many individual agents, each following relatively simple rules and interacting primarily with its local neighbors, without any central control or overarching blueprint dictating the global outcome. The sophisticated architecture of a termite mound, for instance, is not the product of a master architect termite, but the cumulative result of countless termites responding to local pheromonal cues and environmental stimuli.

This ""bottom-up"" organization contrasts sharply with traditional reductionist approaches, which seek to understand a system by dissecting it into its constituent parts and studying them in isolation. While reductionism has been remarkably successful in many scientific domains, it often falls short in explaining systems where the interactions between components are as crucial as the components themselves. In emergent systems, the whole is truly more than the sum of its parts; the macroscopic behavior cannot be readily predicted or understood by merely analyzing the individual agents. The characteristic flocking patterns of birds, for example, can be simulated with models where each bird follows simple rules like maintaining a minimum distance from others, matching velocity with neighbors, and moving towards the perceived center of the group. No single bird ""knows"" the flock's overall shape or direction, yet a coherent, adaptive group behavior emerges.

The study of emergence has profound implications. In biology, it helps explain how complex life forms can arise from simpler precursors and how ecosystems maintain stability. In computer science, it underpins concepts in artificial life and swarm robotics, where decentralized systems of simple robots can collectively perform complex tasks. Understanding emergence can also offer insights into social phenomena, like the formation of public opinion or the spontaneous organization of markets. However, a key challenge in studying emergence is its inherent unpredictability at the micro-level; while we can identify the conditions conducive to emergent phenomena, forecasting the precise nature or timing of the emergent patterns often remains elusive. This unpredictability stems from the non-linear interactions and feedback loops that characterize these systems.

Moreover, the concept of emergence forces us to reconsider notions of control and design. Instead of top-down instruction, influencing emergent systems often requires subtle interventions at the level of individual agent rules or their interaction environment. This paradigm shift is critical for tackling complex contemporary challenges, from managing urban growth to mitigating the spread of epidemics, where centralized solutions may be ineffective or counterproductive. The beauty and power of emergence lie in its capacity to generate novelty, adaptation, and resilience from simplicity.","According to the passage, which of the following is NOT a characteristic of emergent behavior?",It arises from the interactions of multiple individual agents.,It is typically directed by a central coordinating authority or blueprint.,It can result in complex macroscopic patterns from simple local rules.,The overall system behavior may not be predictable by solely analyzing individual components.,A,B,C,D,B,MCQ,RC,RC Passage Genre: Science & Technology,Easy,Supporting Idea / Detail Based,question_id: Q7; section: VARC; question_type: MCQ; topic: RC; sub_topic: RC Passage Genre: Science & Technology; concept_tested: Supporting Idea / Detail Based; difficulty_level: Easy; is_tita: false; set_id: MockSet1_VARC; unique_mock_id: 8c1f7a9b3,False,MockSet1_VARC,Comprehension,"B) It is typically directed by a central coordinating authority or blueprint.
Paragraph 1 explicitly states emergent behavior arises ""without any central control or overarching blueprint dictating the global outcome.""
A, C, and D are all stated or implied characteristics: arises from multiple agents (para 1), complex patterns from simple rules (para 1), and unpredictability from individual analysis (para 2)."
VARC,40,Q8,8,P2_Emergent,"Emergent behavior is a captivating phenomenon observed across diverse complex systems, from the intricate organization of ant colonies to the synchronized movements of starling murmurations and the complex functionalities of the human brain. It refers to the way complex, high-level patterns and behaviors arise from the collective actions of many individual agents, each following relatively simple rules and interacting primarily with its local neighbors, without any central control or overarching blueprint dictating the global outcome. The sophisticated architecture of a termite mound, for instance, is not the product of a master architect termite, but the cumulative result of countless termites responding to local pheromonal cues and environmental stimuli.

This ""bottom-up"" organization contrasts sharply with traditional reductionist approaches, which seek to understand a system by dissecting it into its constituent parts and studying them in isolation. While reductionism has been remarkably successful in many scientific domains, it often falls short in explaining systems where the interactions between components are as crucial as the components themselves. In emergent systems, the whole is truly more than the sum of its parts; the macroscopic behavior cannot be readily predicted or understood by merely analyzing the individual agents. The characteristic flocking patterns of birds, for example, can be simulated with models where each bird follows simple rules like maintaining a minimum distance from others, matching velocity with neighbors, and moving towards the perceived center of the group. No single bird ""knows"" the flock's overall shape or direction, yet a coherent, adaptive group behavior emerges.

The study of emergence has profound implications. In biology, it helps explain how complex life forms can arise from simpler precursors and how ecosystems maintain stability. In computer science, it underpins concepts in artificial life and swarm robotics, where decentralized systems of simple robots can collectively perform complex tasks. Understanding emergence can also offer insights into social phenomena, like the formation of public opinion or the spontaneous organization of markets. However, a key challenge in studying emergence is its inherent unpredictability at the micro-level; while we can identify the conditions conducive to emergent phenomena, forecasting the precise nature or timing of the emergent patterns often remains elusive. This unpredictability stems from the non-linear interactions and feedback loops that characterize these systems.

Moreover, the concept of emergence forces us to reconsider notions of control and design. Instead of top-down instruction, influencing emergent systems often requires subtle interventions at the level of individual agent rules or their interaction environment. This paradigm shift is critical for tackling complex contemporary challenges, from managing urban growth to mitigating the spread of epidemics, where centralized solutions may be ineffective or counterproductive. The beauty and power of emergence lie in its capacity to generate novelty, adaptation, and resilience from simplicity.","Which of the following scenarios best exemplifies the concept of ""influencing emergent systems often requires subtle interventions at the level of individual agent rules or their interaction environment"" as discussed in paragraph 4?","A government issues a strict, nationwide curfew to control public gatherings.",A city planner redesigns an entire district with a completely new road network and building codes to improve traffic flow.,"To encourage healthier eating, a cafeteria subtly places fruits and salads in more prominent positions than sugary snacks.",A software company rewrites its entire operating system from scratch to eliminate security vulnerabilities.,A,B,C,D,C,MCQ,RC,RC Passage Genre: Science & Technology,Hard,Application / Extrapolation,question_id: Q8; section: VARC; question_type: MCQ; topic: RC; sub_topic: RC Passage Genre: Science & Technology; concept_tested: Application / Extrapolation; difficulty_level: Hard; is_tita: false; set_id: MockSet1_VARC; unique_mock_id: 8c1f7a9b3,False,MockSet1_VARC,Application,"C) To encourage healthier eating, a cafeteria subtly places fruits and salads in more prominent positions than sugary snacks.
This scenario exemplifies a subtle intervention at the level of the ""interaction environment"" (food placement) to influence individual choices (agent rules) leading to a desired emergent behavior (healthier eating patterns in the cafeteria).
A is a top-down, strict control, not subtle.
B is a large-scale, top-down redesign, not a subtle intervention in agent rules.
D is a complete overhaul, not a subtle intervention."
VARC,40,Q9,9,P3_SustainableDev,"The concept of ""sustainable development,"" popularized by the 1987 Brundtland Commission Report, ""Our Common Future,"" entered the global lexicon with laudable ambition: ""development that meets the needs of the present without compromising the ability of future generations to meet their own needs."" This definition sought to bridge the perceived chasm between economic growth and environmental protection, proposing a tripartite framework encompassing economic, social, and environmental pillars as interconnected and interdependent. For decades, it has served as a guiding principle for international policy, corporate responsibility initiatives, and developmental aid, ostensibly offering a pathway to prosperity that respects planetary boundaries.

However, the very breadth and inherent optimism of ""sustainable development"" have also rendered it susceptible to critique. One major line of criticism points to its operational vagueness. What constitutes ""needs""? How are trade-offs between the three pillars to be managed when they inevitably conflict? The lack of precise metrics and clear prioritization mechanisms has allowed disparate actors to interpret and implement ""sustainable development"" in ways that serve their pre-existing agendas. Consequently, critics argue, the term has often been co-opted, becoming a veneer of ""greenwashing"" for corporations continuing environmentally damaging practices, or a rhetorical device for governments reluctant to make hard choices that might constrain short-term economic expansion.

Furthermore, a more fundamental critique questions the compatibility of continuous economic growth, a central tenet of most development models, with genuine long-term environmental sustainability. Proponents of ""green growth"" or ""eco-modernism"" argue that technological innovation and market mechanisms can decouple economic growth from resource depletion and environmental degradation. However, skeptics point to the Jevons paradox – where increased efficiency in resource use can lead to increased overall consumption – and the sheer scale of global material throughput, suggesting that absolute decoupling is, at best, a distant hope rather than a current reality. They contend that a truly sustainable future may necessitate a rethinking of growth-centric economic paradigms, a notion that challenges the core assumptions underpinning much of the sustainable development discourse.

Despite these trenchant criticisms, the concept of sustainable development endures, partly because it articulates a powerful and necessary aspiration. It keeps the vital conversation about intergenerational equity and the planet's limits on the agenda. The challenge lies not in abandoning the ideal, but in imbuing it with more rigorous frameworks, transparent accountability, and a willingness to confront the systemic changes required to translate its promise into reality, moving beyond rhetoric to substantive action that genuinely prioritizes ecological integrity and social equity alongside economic considerations.",Which of the following best summarizes the main argument of the passage?,"Sustainable development is a flawless concept that has been perfectly implemented globally, leading to significant environmental improvements.",The Brundtland Commission's definition of sustainable development is too narrow and excludes crucial social factors.,"While the concept of sustainable development is aspirational and important, its vagueness and the challenge of decoupling growth from environmental impact have led to significant criticisms and implementation challenges.","Technological innovation is the sole key to achieving sustainable development, rendering all critiques of the concept invalid.",A,B,C,D,C,MCQ,RC,RC Passage Genre: Economics & Business,Medium,Main Idea / Central Theme / Primary Purpose,question_id: Q9; section: VARC; question_type: MCQ; topic: RC; sub_topic: RC Passage Genre: Economics & Business; concept_tested: Main Idea / Central Theme / Primary Purpose; difficulty_level: Medium; is_tita: false; set_id: MockSet1_VARC; unique_mock_id: 8c1f7a9b3,False,MockSet1_VARC,Comprehension,"C) While the concept of sustainable development is aspirational and important, its vagueness and the challenge of decoupling growth from environmental impact have led to significant criticisms and implementation challenges.
The passage introduces sustainable development as ambitious (para 1), then details criticisms like vagueness, co-option (para 2), and the growth-sustainability conflict (para 3), while acknowledging its enduring importance (para 4).
A is incorrect; the passage extensively discusses criticisms.
B is incorrect; the passage mentions the three pillars, including social, and critiques its vagueness, not narrowness in this specific way.
D is incorrect; the passage presents technological innovation as one viewpoint (green growth) but also presents skepticism about it."
VARC,40,Q10,10,P3_SustainableDev,"The concept of ""sustainable development,"" popularized by the 1987 Brundtland Commission Report, ""Our Common Future,"" entered the global lexicon with laudable ambition: ""development that meets the needs of the present without compromising the ability of future generations to meet their own needs."" This definition sought to bridge the perceived chasm between economic growth and environmental protection, proposing a tripartite framework encompassing economic, social, and environmental pillars as interconnected and interdependent. For decades, it has served as a guiding principle for international policy, corporate responsibility initiatives, and developmental aid, ostensibly offering a pathway to prosperity that respects planetary boundaries.

However, the very breadth and inherent optimism of ""sustainable development"" have also rendered it susceptible to critique. One major line of criticism points to its operational vagueness. What constitutes ""needs""? How are trade-offs between the three pillars to be managed when they inevitably conflict? The lack of precise metrics and clear prioritization mechanisms has allowed disparate actors to interpret and implement ""sustainable development"" in ways that serve their pre-existing agendas. Consequently, critics argue, the term has often been co-opted, becoming a veneer of ""greenwashing"" for corporations continuing environmentally damaging practices, or a rhetorical device for governments reluctant to make hard choices that might constrain short-term economic expansion.

Furthermore, a more fundamental critique questions the compatibility of continuous economic growth, a central tenet of most development models, with genuine long-term environmental sustainability. Proponents of ""green growth"" or ""eco-modernism"" argue that technological innovation and market mechanisms can decouple economic growth from resource depletion and environmental degradation. However, skeptics point to the Jevons paradox – where increased efficiency in resource use can lead to increased overall consumption – and the sheer scale of global material throughput, suggesting that absolute decoupling is, at best, a distant hope rather than a current reality. They contend that a truly sustainable future may necessitate a rethinking of growth-centric economic paradigms, a notion that challenges the core assumptions underpinning much of the sustainable development discourse.

Despite these trenchant criticisms, the concept of sustainable development endures, partly because it articulates a powerful and necessary aspiration. It keeps the vital conversation about intergenerational equity and the planet's limits on the agenda. The challenge lies not in abandoning the ideal, but in imbuing it with more rigorous frameworks, transparent accountability, and a willingness to confront the systemic changes required to translate its promise into reality, moving beyond rhetoric to substantive action that genuinely prioritizes ecological integrity and social equity alongside economic considerations.",It can be inferred from the passage that the author believes:,the concept of sustainable development should be entirely discarded due to its flaws.,"""greenwashing"" is a rare phenomenon and not a significant concern in the implementation of sustainable development.",the economic pillar of sustainable development should always take precedence over environmental and social concerns.,a critical re-evaluation and more robust application of sustainable development principles are necessary.,A,B,C,D,D,MCQ,RC,RC Passage Genre: Economics & Business,Medium,Inference / Implied Meaning,question_id: Q10; section: VARC; question_type: MCQ; topic: RC; sub_topic: RC Passage Genre: Economics & Business; concept_tested: Inference / Implied Meaning; difficulty_level: Medium; is_tita: false; set_id: MockSet1_VARC; unique_mock_id: 8c1f7a9b3,False,MockSet1_VARC,Analysis,"D) a critical re-evaluation and more robust application of sustainable development principles are necessary.
The last paragraph states, ""The challenge lies not in abandoning the ideal, but in imbuing it with more rigorous frameworks, transparent accountability, and a willingness to confront the systemic changes required..."" This points to a need for re-evaluation and better application.
A is incorrect; the author suggests the concept endures because it's a ""necessary aspiration.""
B is incorrect; the passage explicitly mentions ""greenwashing"" as a consequence of co-option (para 2).
C is not supported; the passage implies a balance is intended, though difficult to achieve."
