SectionName,SectionTimeLimitMinutes,QuestionUniqueID,QuestionNumberInSection,PassageOrSetID,PassageOrSetContent,QuestionPrompt,OptionAText,OptionBText,OptionCText,OptionDText,OptionAValue,OptionBValue,OptionCValue,OptionDValue,CorrectAnswerValue,QuestionType,Topic,SubTopic,DifficultyLevelPredicted,ConceptTested,DetailedTags,IsTITA,SetID,CognitiveSkillLevel,SolutionExplanation
VARC,40,Q11,11,P3_CentralBanks,"Central banks, traditionally the staid custodians of monetary stability and financial order, find themselves navigating an era of unprecedented transformation. For decades, their primary mandate revolved around controlling inflation, managing interest rates, and acting as lenders of last resort. This was largely achieved through conventional tools: setting the policy rate, managing reserve requirements for commercial banks, and conducting open market operations. However, the aftermath of the 2008 financial crisis and the subsequent rise of digital technologies have profoundly reshaped the landscape, compelling central banks to innovate and expand their roles, often into uncharted territory.

The prolonged period of low inflation and low interest rates following the 2008 crisis pushed many central banks towards unconventional monetary policies (UMPs), such as quantitative easing (QE) – large-scale asset purchases – and negative interest rates. While these measures were intended to stimulate economies and avert deflation, their long-term efficacy and unintended consequences, such as asset bubbles and increased wealth inequality, remain subjects of intense debate. The sheer scale of these interventions has also significantly expanded central bank balance sheets, raising questions about their future unwinding and the potential for market disruption.

Adding another layer of complexity is the rapid proliferation of digital currencies. Cryptocurrencies like Bitcoin, initially dismissed by many in the financial establishment, have demonstrated the potential of decentralized ledger technology. While their volatility and scalability issues currently limit their use as mainstream currency, they have spurred central banks to explore their own digital currencies (CBDCs). The motivations for CBDCs are varied: enhancing payment efficiency, promoting financial inclusion, countering the rise of private digital currencies, and maintaining monetary sovereignty. However, the design and implementation of CBDCs pose significant challenges, including privacy concerns, cybersecurity risks, and the potential impact on the existing two-tier banking system, where commercial banks play a crucial intermediary role.

Furthermore, central banks are increasingly expected to address broader societal challenges, such as climate change and inequality. Some argue that central banks should incorporate climate-related risks into their financial stability frameworks and use their asset purchase programs to support green investments. Others caution against ""mission creep,"" warning that an overextension of mandates could compromise central bank independence and effectiveness in their core functions. The path forward requires a delicate balancing act: embracing innovation to maintain relevance and effectiveness in a digital world, while prudently managing new risks and preserving public trust in their traditional roles of ensuring monetary and financial stability.","According to the passage, unconventional monetary policies (UMPs) were primarily implemented because:",central banks wanted to experiment with new economic theories.,traditional monetary tools proved insufficient in the post-2008 economic climate.,digital currencies began to threaten the stability of conventional money.,there was a global consensus to increase wealth inequality.,A,B,C,D,B,MCQ,RC,RC Passage Genre: Economics & Business,Medium,Supporting Idea / Detail Based,"question_id:Q11, section:VARC, question_type:MCQ, topic:RC, sub_topic:RC Passage Genre: Economics & Business, concept_tested:Supporting Idea / Detail Based, difficulty_level:Medium, is_tita:false, set_id:MockSet1_VARC, unique_mock_id:8f9a0c1b2",False,MockSet1_VARC,Understanding,"Paragraph 2 states, ""The prolonged period of low inflation and low interest rates following the 2008 crisis pushed many central banks towards unconventional monetary policies (UMPs)... While these measures were intended to stimulate economies and avert deflation..."" This implies that conventional tools, which typically work by adjusting interest rates, were not effective enough in that low-rate environment.
Option A is not supported; UMPs were a response to economic conditions, not just experimentation.
Option C is chronologically misplaced; UMPs predate the widespread concern over digital currencies impacting central banks.
Option D is an absurd misinterpretation of the reasons for UMPs."
VARC,40,Q12,12,P3_CentralBanks,"Central banks, traditionally the staid custodians of monetary stability and financial order, find themselves navigating an era of unprecedented transformation. For decades, their primary mandate revolved around controlling inflation, managing interest rates, and acting as lenders of last resort. This was largely achieved through conventional tools: setting the policy rate, managing reserve requirements for commercial banks, and conducting open market operations. However, the aftermath of the 2008 financial crisis and the subsequent rise of digital technologies have profoundly reshaped the landscape, compelling central banks to innovate and expand their roles, often into uncharted territory.

The prolonged period of low inflation and low interest rates following the 2008 crisis pushed many central banks towards unconventional monetary policies (UMPs), such as quantitative easing (QE) – large-scale asset purchases – and negative interest rates. While these measures were intended to stimulate economies and avert deflation, their long-term efficacy and unintended consequences, such as asset bubbles and increased wealth inequality, remain subjects of intense debate. The sheer scale of these interventions has also significantly expanded central bank balance sheets, raising questions about their future unwinding and the potential for market disruption.

Adding another layer of complexity is the rapid proliferation of digital currencies. Cryptocurrencies like Bitcoin, initially dismissed by many in the financial establishment, have demonstrated the potential of decentralized ledger technology. While their volatility and scalability issues currently limit their use as mainstream currency, they have spurred central banks to explore their own digital currencies (CBDCs). The motivations for CBDCs are varied: enhancing payment efficiency, promoting financial inclusion, countering the rise of private digital currencies, and maintaining monetary sovereignty. However, the design and implementation of CBDCs pose significant challenges, including privacy concerns, cybersecurity risks, and the potential impact on the existing two-tier banking system, where commercial banks play a crucial intermediary role.

Furthermore, central banks are increasingly expected to address broader societal challenges, such as climate change and inequality. Some argue that central banks should incorporate climate-related risks into their financial stability frameworks and use their asset purchase programs to support green investments. Others caution against ""mission creep,"" warning that an overextension of mandates could compromise central bank independence and effectiveness in their core functions. The path forward requires a delicate balancing act: embracing innovation to maintain relevance and effectiveness in a digital world, while prudently managing new risks and preserving public trust in their traditional roles of ensuring monetary and financial stability.","Which of the following scenarios best exemplifies the concern of ""mission creep"" as discussed in the final paragraph?","A central bank focuses solely on maintaining a low and stable inflation rate, ignoring calls to address unemployment.",A central bank's governor gives a speech outlining the potential risks of cryptocurrencies to financial stability.,A central bank uses its asset purchase program to preferentially buy bonds from companies with high environmental sustainability ratings.,A central bank collaborates with international bodies to standardize regulations for cross-border payments.,A,B,C,D,C,MCQ,RC,RC Passage Genre: Economics & Business,Hard,Application / Extrapolation,"question_id:Q12, section:VARC, question_type:MCQ, topic:RC, sub_topic:RC Passage Genre: Economics & Business, concept_tested:Application / Extrapolation, difficulty_level:Hard, is_tita:false, set_id:MockSet1_VARC, unique_mock_id:8f9a0c1b2",False,MockSet1_VARC,Applying,"The final paragraph discusses ""mission creep"" in the context of central banks addressing ""broader societal challenges, such as climate change."" It mentions some arguing that central banks should ""use their asset purchase programs to support green investments."" This scenario directly reflects using a monetary policy tool for a non-traditional, societal goal (environmental sustainability), which is the essence of the ""mission creep"" concern described.
Option A describes a central bank sticking to its core mandate, the opposite of mission creep.
Option B is part of a central bank's financial stability role, not mission creep.
Option D involves international collaboration on a core function (payments), not necessarily an overextension of mandate into unrelated areas."
VARC,40,Q13,13,P4_ProgressNarrative,"The notion of ""progress,"" particularly the idea of a continuous, linear trajectory of human improvement driven by reason and technological advancement, is a powerful and deeply embedded narrative in Western thought. Originating prominently during the Enlightenment, this concept posited history as a teleological unfolding towards an ever-better future, characterized by increased knowledge, material prosperity, individual liberty, and moral refinement. Thinkers like Condorcet envisioned humanity marching inexorably towards perfection. This optimistic belief fueled scientific inquiry, political revolutions, and colonial expansion, often justifying the latter as a means of bringing ""civilization"" to supposedly less developed societies.

However, the 20th and 21st centuries have witnessed a profound and multifaceted critique of this triumphalist narrative of progress. The devastating world wars, the rise of totalitarian regimes, the looming threat of nuclear annihilation, and the escalating environmental crisis have severely dented the Enlightenment's optimistic faith in reason and technology as unalloyed goods. Critics argue that the pursuit of progress, as traditionally conceived, has often led to unforeseen and detrimental consequences, including social alienation, ecological devastation, and the homogenization of cultures. The very tools intended for liberation and improvement have frequently been co-opted for oppression and destruction.

Postmodern and postcolonial thinkers have further challenged the universality and benevolence of the progress narrative. They contend that it is often a Eurocentric construct, one that devalues non-Western cultures and ways of knowing, and legitimizes historical and ongoing global inequalities. The idea that all societies are, or should be, moving along the same developmental path towards a Western model is seen as a form of intellectual imperialism. These critiques highlight how the concept of progress can mask power dynamics and serve the interests of dominant groups. For instance, economic ""development"" often translates into the exploitation of resources and labor in the Global South for the benefit of the North.

Consequently, contemporary discussions are increasingly focused on redefining or even abandoning the singular, linear model of progress. Alternative visions emphasize sustainability, equity, cultural diversity, and well-being metrics that go beyond mere economic growth or technological prowess. The focus shifts from a predetermined destination to a more nuanced understanding of change, acknowledging that development can be multi-directional, context-specific, and involve trade-offs. This doesn't necessarily mean a wholesale rejection of improvement or learning from the past, but rather a more critical, pluralistic, and cautious approach to envisioning desirable futures, one that is acutely aware of the complex, often paradoxical, nature of human endeavors and their impact on the planet.",The primary purpose of the passage is to:,advocate for a return to the Enlightenment ideal of progress.,provide a historical account of technological advancements.,analyze and critique the traditional Western concept of linear progress.,compare Western and non-Western views on societal development.,A,B,C,D,C,MCQ,RC,RC Passage Genre: Abstract & Philosophical,Medium,Main Idea / Central Theme / Primary Purpose,"question_id:Q13, section:VARC, question_type:MCQ, topic:RC, sub_topic:RC Passage Genre: Abstract & Philosophical, concept_tested:Main Idea / Central Theme / Primary Purpose, difficulty_level:Medium, is_tita:false, set_id:MockSet1_VARC, unique_mock_id:8f9a0c1b2",False,MockSet1_VARC,Analyzing,"The passage introduces the concept of linear progress (Para 1), then dedicates significant space to its critiques from various perspectives – historical events (Para 2), postmodern/postcolonial thought (Para 3), and the resulting shift towards alternative views (Para 4). This constitutes an analysis and critique.
Option A is the opposite of the passage's thrust, which is largely critical of the traditional ideal.
Option B is too narrow; technological advancements are mentioned as part of the progress narrative, but the passage is broader.
Option D is a component of the critique (Para 3) but not the overall primary purpose of the entire passage."
VARC,40,Q14,14,P4_ProgressNarrative,"The notion of ""progress,"" particularly the idea of a continuous, linear trajectory of human improvement driven by reason and technological advancement, is a powerful and deeply embedded narrative in Western thought. Originating prominently during the Enlightenment, this concept posited history as a teleological unfolding towards an ever-better future, characterized by increased knowledge, material prosperity, individual liberty, and moral refinement. Thinkers like Condorcet envisioned humanity marching inexorably towards perfection. This optimistic belief fueled scientific inquiry, political revolutions, and colonial expansion, often justifying the latter as a means of bringing ""civilization"" to supposedly less developed societies.

However, the 20th and 21st centuries have witnessed a profound and multifaceted critique of this triumphalist narrative of progress. The devastating world wars, the rise of totalitarian regimes, the looming threat of nuclear annihilation, and the escalating environmental crisis have severely dented the Enlightenment's optimistic faith in reason and technology as unalloyed goods. Critics argue that the pursuit of progress, as traditionally conceived, has often led to unforeseen and detrimental consequences, including social alienation, ecological devastation, and the homogenization of cultures. The very tools intended for liberation and improvement have frequently been co-opted for oppression and destruction.

Postmodern and postcolonial thinkers have further challenged the universality and benevolence of the progress narrative. They contend that it is often a Eurocentric construct, one that devalues non-Western cultures and ways of knowing, and legitimizes historical and ongoing global inequalities. The idea that all societies are, or should be, moving along the same developmental path towards a Western model is seen as a form of intellectual imperialism. These critiques highlight how the concept of progress can mask power dynamics and serve the interests of dominant groups. For instance, economic ""development"" often translates into the exploitation of resources and labor in the Global South for the benefit of the North.

Consequently, contemporary discussions are increasingly focused on redefining or even abandoning the singular, linear model of progress. Alternative visions emphasize sustainability, equity, cultural diversity, and well-being metrics that go beyond mere economic growth or technological prowess. The focus shifts from a predetermined destination to a more nuanced understanding of change, acknowledging that development can be multi-directional, context-specific, and involve trade-offs. This doesn't necessarily mean a wholesale rejection of improvement or learning from the past, but rather a more critical, pluralistic, and cautious approach to envisioning desirable futures, one that is acutely aware of the complex, often paradoxical, nature of human endeavors and their impact on the planet.","Based on the passage, the author would most likely agree with which of the following statements about technological advancements?",They are the sole and unambiguous drivers of human betterment.,Their impact is inherently positive and leads directly to moral refinement.,They should be pursued without questioning their potential downsides.,"They are tools whose consequences can be both beneficial and detrimental, depending on their application and context.",A,B,C,D,D,MCQ,RC,RC Passage Genre: Abstract & Philosophical,Medium,Author Agrees/Disagrees,"question_id:Q14, section:VARC, question_type:MCQ, topic:RC, sub_topic:RC Passage Genre: Abstract & Philosophical, concept_tested:Author Agrees/Disagrees, difficulty_level:Medium, is_tita:false, set_id:MockSet1_VARC, unique_mock_id:8f9a0c1b2",False,MockSet1_VARC,Analyzing,"The passage states that the Enlightenment saw technology as driving progress (Para 1), but later notes, ""The very tools intended for liberation and improvement have frequently been co-opted for oppression and destruction"" (Para 2). This highlights the dual potential of technology. The final paragraph's call for a ""cautious approach"" further supports this nuanced view.
Option A is refuted by the critiques of progress (""unalloyed goods"" is questioned).
Option B is refuted; the passage notes detrimental consequences and a dent in faith in technology leading to moral refinement.
Option C is directly contradicted by the passage's critical stance and call for a more cautious approach."
VARC,40,Q16,16,P4_ProgressNarrative,"The notion of ""progress,"" particularly the idea of a continuous, linear trajectory of human improvement driven by reason and technological advancement, is a powerful and deeply embedded narrative in Western thought. Originating prominently during the Enlightenment, this concept posited history as a teleological unfolding towards an ever-better future, characterized by increased knowledge, material prosperity, individual liberty, and moral refinement. Thinkers like Condorcet envisioned humanity marching inexorably towards perfection. This optimistic belief fueled scientific inquiry, political revolutions, and colonial expansion, often justifying the latter as a means of bringing ""civilization"" to supposedly less developed societies.

However, the 20th and 21st centuries have witnessed a profound and multifaceted critique of this triumphalist narrative of progress. The devastating world wars, the rise of totalitarian regimes, the looming threat of nuclear annihilation, and the escalating environmental crisis have severely dented the Enlightenment's optimistic faith in reason and technology as unalloyed goods. Critics argue that the pursuit of progress, as traditionally conceived, has often led to unforeseen and detrimental consequences, including social alienation, ecological devastation, and the homogenization of cultures. The very tools intended for liberation and improvement have frequently been co-opted for oppression and destruction.

Postmodern and postcolonial thinkers have further challenged the universality and benevolence of the progress narrative. They contend that it is often a Eurocentric construct, one that devalues non-Western cultures and ways of knowing, and legitimizes historical and ongoing global inequalities. The idea that all societies are, or should be, moving along the same developmental path towards a Western model is seen as a form of intellectual imperialism. These critiques highlight how the concept of progress can mask power dynamics and serve the interests of dominant groups. For instance, economic ""development"" often translates into the exploitation of resources and labor in the Global South for the benefit of the North.

Consequently, contemporary discussions are increasingly focused on redefining or even abandoning the singular, linear model of progress. Alternative visions emphasize sustainability, equity, cultural diversity, and well-being metrics that go beyond mere economic growth or technological prowess. The focus shifts from a predetermined destination to a more nuanced understanding of change, acknowledging that development can be multi-directional, context-specific, and involve trade-offs. This doesn't necessarily mean a wholesale rejection of improvement or learning from the past, but rather a more critical, pluralistic, and cautious approach to envisioning desirable futures, one that is acutely aware of the complex, often paradoxical, nature of human endeavors and their impact on the planet.",The passage suggests that postmodern and postcolonial thinkers view the traditional Western concept of progress as:,a universally applicable model for all societies to emulate.,a benign framework that has historically benefited all cultures equally.,an objective and neutral measure of societal advancement.,a culturally specific construct that has often served to justify dominance and inequality.,A,B,C,D,D,MCQ,RC,RC Passage Genre: Abstract & Philosophical,Medium,Inference / Implied Meaning,"question_id:Q16, section:VARC, question_type:MCQ, topic:RC, sub_topic:RC Passage Genre: Abstract & Philosophical, concept_tested:Inference / Implied Meaning, difficulty_level:Medium, is_tita:false, set_id:MockSet1_VARC, unique_mock_id:8f9a0c1b2",False,MockSet1_VARC,Analyzing,"Paragraph 3 states, ""Postmodern and postcolonial thinkers... contend that it is often a Eurocentric construct... that devalues non-Western cultures... and legitimizes historical and ongoing global inequalities."" It also mentions how it can ""mask power dynamics and serve the interests of dominant groups.""
Option A is what these thinkers critique, not what they believe.
Option B is directly contradicted by their arguments about legitimizing inequality.
Option C is also contradicted; they see it as a ""Eurocentric construct,"" not objective or neutral."
VARC,40,Q17,17,VA_OOO_ScientificMethod,"1. The formulation of a clear, testable hypothesis is the cornerstone of rigorous scientific inquiry.
2. This hypothesis is then subjected to empirical testing through carefully designed experiments or observations.
3. Many scientific breakthroughs have occurred serendipitously, without a pre-defined hypothesis.
4. Data gathered is meticulously analyzed to determine whether it supports or refutes the initial hypothesis.
5. The process is iterative, with results often leading to refined hypotheses and further investigation.","Five jumbled sentences are given below. Four of them can be put together to form a coherent paragraph. Identify the odd one out.

The formulation of a clear, testable hypothesis is the cornerstone of rigorous scientific inquiry.

This hypothesis is then subjected to empirical testing through carefully designed experiments or observations.

Many scientific breakthroughs have occurred serendipitously, without a pre-defined hypothesis.

Data gathered is meticulously analyzed to determine whether it supports or refutes the initial hypothesis.

The process is iterative, with results often leading to refined hypotheses and further investigation.
Type in the number of the odd sentence.",,,,,,,,,3,TITA,VA,Odd One Out (Sentence Exclusion),Medium,Coherence & Theme Identification / Direct Application,"question_id:Q17, section:VARC, question_type:TITA, topic:VA, sub_topic:Odd One Out (Sentence Exclusion), concept_tested:Coherence & Theme Identification / Direct Application, difficulty_level:Medium, is_tita:true, set_id:MockSet1_VARC, unique_mock_id:8f9a0c1b2",True,MockSet1_VARC,Analyzing,"Sentences 1, 2, 4, and 5 describe the systematic, hypothesis-driven scientific method: 1 (formulate hypothesis) -> 2 (test hypothesis) -> 4 (analyze data) -> 5 (iterate/refine). Sentence 3, ""Many scientific breakthroughs have occurred serendipitously, without a pre-defined hypothesis,"" introduces an alternative path to discovery (serendipity) that contrasts with the methodical process described by the other sentences. Therefore, 3 is the odd one out.
Coherent paragraph order: 1245."
