SectionName,SectionTimeLimitMinutes,QuestionUniqueID,QuestionNumberInSection,PassageOrSetID,PassageOrSetContent,QuestionPrompt,OptionAText,OptionBText,OptionCText,OptionDText,OptionAValue,OptionBValue,OptionCValue,OptionDValue,CorrectAnswerValue,QuestionType,Topic,SubTopic,DifficultyLevelPredicted,ConceptTested,DetailedTags,IsTITA,SetID,CognitiveSkillLevel,SolutionExplanation
VARC,40,Q1,1,P1_Annales,"The Annales School, emerging in early 20th-century France, represented a seismic shift in historical methodology. Spearheaded by Lucien Febvre and Marc Bloch, and later iconically championed by Fernand Braudel, this intellectual movement sought to dismantle the traditional, event-focused, narrative-driven historiography that had long privileged political figures and diplomatic maneuvering – what Braudel derisively termed *l'histoire événementielle*, or ""event history."" Instead, the Annalistes advocated for a ""total history"" (*histoire totale*), one that embraced a multidisciplinary approach, integrating insights from geography, sociology, economics, anthropology, and psychology to reconstruct the past in its fullest complexity.

A cornerstone of the Annales paradigm was the concept of the *longue durée*, or ""long term."" Braudel, in particular, emphasized that the most profound historical changes were not the fleeting political upheavals but the slow, almost imperceptible transformations occurring over centuries in structures like geography, climate, demography, and collective mentalities (*mentalités*). These deep currents, he argued, shaped the material and cultural possibilities within which shorter-term events unfolded. The *longue durée* was contrasted with medium-term conjunctures (cyclical economic or social trends spanning decades) and the short-term froth of events. For the Annalistes, understanding these underlying structures was paramount to grasping the true dynamics of historical change. This approach necessitated new kinds of evidence: price series, parish registers, folk tales, agricultural patterns – sources often overlooked by conventional historians fixated on state archives.

The study of *mentalités* – the collective attitudes, beliefs, and assumptions of people in a given period – was another crucial innovation. Febvre's work on unbelief in the 16th century, for instance, explored not just what prominent thinkers wrote, but the ""mental toolkit"" available to people of that era, arguing that widespread atheism was conceptually impossible given the prevailing intellectual framework. This focus on the internal worlds and shared cultural frameworks of past societies marked a significant departure from histories centered on rational actors and overt political motivations.

While the Annales School has faced critiques – some argue its structuralism underplays human agency, others find its ""total history"" ambition unwieldy or its later iterations overly fragmented – its impact remains undeniable. It broadened the scope of historical inquiry, legitimized new objects of study, and profoundly influenced historiographical practices globally, compelling historians to look beyond the surface of events to the deeper, slower rhythms of human experience and the material and mental structures that shaped them. Its legacy is evident in fields as diverse as environmental history, microhistory, and the history of everyday life.",The primary purpose of the passage is to:,critique the Annales School's overemphasis on structuralism at the expense of individual agency.,trace the biographical details of the leading figures of the Annales School.,explain the methodological innovations and key concepts of the Annales School and assess its impact on historiography.,argue for the superiority of *l'histoire événementielle* over the Annales approach.,A,B,C,D,C,MCQ,RC,RC Passage Genre: Humanities & Social Sciences,Medium,Main Idea / Central Theme / Primary Purpose,question_id: Q1; section: VARC; question_type: MCQ; topic: RC; sub_topic: RC Passage Genre: Humanities & Social Sciences; concept_tested: Main Idea / Central Theme / Primary Purpose; difficulty_level: Medium; is_tita: false; set_id: MockSet1_VARC; unique_mock_id: 8c1f7a9b3,False,MockSet1_VARC,Comprehension,"C) explain the methodological innovations and key concepts of the Annales School and assess its impact on historiography.
The passage introduces the Annales School (para 1), explains its key concepts like *l'histoire événementielle*, *histoire totale*, *longue durée*, and *mentalités* (paras 1, 2, 3), and discusses its impact and critiques (para 4).
A is too narrow, focusing only on a critique mentioned briefly.
B is incorrect; while figures are named, their biographies are not the focus.
D is contradictory to the passage's generally positive portrayal of the Annales School's innovations."
VARC,40,Q2,2,P1_Annales,"The Annales School, emerging in early 20th-century France, represented a seismic shift in historical methodology. Spearheaded by Lucien Febvre and Marc Bloch, and later iconically championed by Fernand Braudel, this intellectual movement sought to dismantle the traditional, event-focused, narrative-driven historiography that had long privileged political figures and diplomatic maneuvering – what Braudel derisively termed *l'histoire événementielle*, or ""event history."" Instead, the Annalistes advocated for a ""total history"" (*histoire totale*), one that embraced a multidisciplinary approach, integrating insights from geography, sociology, economics, anthropology, and psychology to reconstruct the past in its fullest complexity.

A cornerstone of the Annales paradigm was the concept of the *longue durée*, or ""long term."" Braudel, in particular, emphasized that the most profound historical changes were not the fleeting political upheavals but the slow, almost imperceptible transformations occurring over centuries in structures like geography, climate, demography, and collective mentalities (*mentalités*). These deep currents, he argued, shaped the material and cultural possibilities within which shorter-term events unfolded. The *longue durée* was contrasted with medium-term conjunctures (cyclical economic or social trends spanning decades) and the short-term froth of events. For the Annalistes, understanding these underlying structures was paramount to grasping the true dynamics of historical change. This approach necessitated new kinds of evidence: price series, parish registers, folk tales, agricultural patterns – sources often overlooked by conventional historians fixated on state archives.

The study of *mentalités* – the collective attitudes, beliefs, and assumptions of people in a given period – was another crucial innovation. Febvre's work on unbelief in the 16th century, for instance, explored not just what prominent thinkers wrote, but the ""mental toolkit"" available to people of that era, arguing that widespread atheism was conceptually impossible given the prevailing intellectual framework. This focus on the internal worlds and shared cultural frameworks of past societies marked a significant departure from histories centered on rational actors and overt political motivations.

While the Annales School has faced critiques – some argue its structuralism underplays human agency, others find its ""total history"" ambition unwieldy or its later iterations overly fragmented – its impact remains undeniable. It broadened the scope of historical inquiry, legitimized new objects of study, and profoundly influenced historiographical practices globally, compelling historians to look beyond the surface of events to the deeper, slower rhythms of human experience and the material and mental structures that shaped them. Its legacy is evident in fields as diverse as environmental history, microhistory, and the history of everyday life.","It can be inferred from the passage that, prior to the Annales School, historical scholarship predominantly:","utilized a wide array of interdisciplinary sources, including folk tales and agricultural patterns.",focused on long-term socio-economic trends and collective mentalities.,emphasized the actions of prominent individuals and major political occurrences.,"considered the ""mental toolkit"" of ordinary people as crucial for understanding historical periods.",A,B,C,D,C,MCQ,RC,RC Passage Genre: Humanities & Social Sciences,Medium,Inference / Implied Meaning,question_id: Q2; section: VARC; question_type: MCQ; topic: RC; sub_topic: RC Passage Genre: Humanities & Social Sciences; concept_tested: Inference / Implied Meaning; difficulty_level: Medium; is_tita: false; set_id: MockSet1_VARC; unique_mock_id: 8c1f7a9b3,False,MockSet1_VARC,Analysis,"C) emphasized the actions of prominent individuals and major political occurrences.
Paragraph 1 states the Annales School sought to dismantle traditional historiography that ""privileged political figures and diplomatic maneuvering – what Braudel derisively termed *l'histoire événementielle*."" This implies the prior focus was on such events and figures.
A is incorrect; the passage says the Annales School necessitated ""new kinds of evidence"" like folk tales, implying these were previously overlooked.
B is incorrect; these were innovations of the Annales School.
D is incorrect; the study of *mentalités* was an Annales innovation."
VARC,40,Q3,3,P1_Annales,"The Annales School, emerging in early 20th-century France, represented a seismic shift in historical methodology. Spearheaded by Lucien Febvre and Marc Bloch, and later iconically championed by Fernand Braudel, this intellectual movement sought to dismantle the traditional, event-focused, narrative-driven historiography that had long privileged political figures and diplomatic maneuvering – what Braudel derisively termed *l'histoire événementielle*, or ""event history."" Instead, the Annalistes advocated for a ""total history"" (*histoire totale*), one that embraced a multidisciplinary approach, integrating insights from geography, sociology, economics, anthropology, and psychology to reconstruct the past in its fullest complexity.

A cornerstone of the Annales paradigm was the concept of the *longue durée*, or ""long term."" Braudel, in particular, emphasized that the most profound historical changes were not the fleeting political upheavals but the slow, almost imperceptible transformations occurring over centuries in structures like geography, climate, demography, and collective mentalities (*mentalités*). These deep currents, he argued, shaped the material and cultural possibilities within which shorter-term events unfolded. The *longue durée* was contrasted with medium-term conjunctures (cyclical economic or social trends spanning decades) and the short-term froth of events. For the Annalistes, understanding these underlying structures was paramount to grasping the true dynamics of historical change. This approach necessitated new kinds of evidence: price series, parish registers, folk tales, agricultural patterns – sources often overlooked by conventional historians fixated on state archives.

The study of *mentalités* – the collective attitudes, beliefs, and assumptions of people in a given period – was another crucial innovation. Febvre's work on unbelief in the 16th century, for instance, explored not just what prominent thinkers wrote, but the ""mental toolkit"" available to people of that era, arguing that widespread atheism was conceptually impossible given the prevailing intellectual framework. This focus on the internal worlds and shared cultural frameworks of past societies marked a significant departure from histories centered on rational actors and overt political motivations.

While the Annales School has faced critiques – some argue its structuralism underplays human agency, others find its ""total history"" ambition unwieldy or its later iterations overly fragmented – its impact remains undeniable. It broadened the scope of historical inquiry, legitimized new objects of study, and profoundly influenced historiographical practices globally, compelling historians to look beyond the surface of events to the deeper, slower rhythms of human experience and the material and mental structures that shaped them. Its legacy is evident in fields as diverse as environmental history, microhistory, and the history of everyday life.",The author mentions Febvre's work on unbelief in the 16th century (paragraph 3) primarily to:,provide an example of the Annales School's focus on collective mentalities and the intellectual frameworks of past societies.,demonstrate a flaw in the Annales approach by highlighting its speculative nature.,contrast Febvre's methodology with that of Marc Bloch.,argue that religious history was the central concern of the Annales historians.,A,B,C,D,A,MCQ,RC,RC Passage Genre: Humanities & Social Sciences,Medium,Supporting Idea / Detail Based,question_id: Q3; section: VARC; question_type: MCQ; topic: RC; sub_topic: RC Passage Genre: Humanities & Social Sciences; concept_tested: Supporting Idea / Detail Based; difficulty_level: Medium; is_tita: false; set_id: MockSet1_VARC; unique_mock_id: 8c1f7a9b3,False,MockSet1_VARC,Comprehension,"A) provide an example of the Annales School's focus on collective mentalities and the intellectual frameworks of past societies.
Paragraph 3 introduces *mentalités* as a ""crucial innovation"" and then presents Febvre's work as an instance: ""Febvre's work on unbelief...explored not just what prominent thinkers wrote, but the 'mental toolkit' available to people of that era.""
B is incorrect; the passage presents this work as an example of their approach, not a flaw.
C is not supported; no such contrast is made.
D is too narrow; while it's an example, it doesn't mean religious history was the *central* concern."
VARC,40,Q4,4,P1_Annales,"The Annales School, emerging in early 20th-century France, represented a seismic shift in historical methodology. Spearheaded by Lucien Febvre and Marc Bloch, and later iconically championed by Fernand Braudel, this intellectual movement sought to dismantle the traditional, event-focused, narrative-driven historiography that had long privileged political figures and diplomatic maneuvering – what Braudel derisively termed *l'histoire événementielle*, or ""event history."" Instead, the Annalistes advocated for a ""total history"" (*histoire totale*), one that embraced a multidisciplinary approach, integrating insights from geography, sociology, economics, anthropology, and psychology to reconstruct the past in its fullest complexity.

A cornerstone of the Annales paradigm was the concept of the *longue durée*, or ""long term."" Braudel, in particular, emphasized that the most profound historical changes were not the fleeting political upheavals but the slow, almost imperceptible transformations occurring over centuries in structures like geography, climate, demography, and collective mentalities (*mentalités*). These deep currents, he argued, shaped the material and cultural possibilities within which shorter-term events unfolded. The *longue durée* was contrasted with medium-term conjunctures (cyclical economic or social trends spanning decades) and the short-term froth of events. For the Annalistes, understanding these underlying structures was paramount to grasping the true dynamics of historical change. This approach necessitated new kinds of evidence: price series, parish registers, folk tales, agricultural patterns – sources often overlooked by conventional historians fixated on state archives.

The study of *mentalités* – the collective attitudes, beliefs, and assumptions of people in a given period – was another crucial innovation. Febvre's work on unbelief in the 16th century, for instance, explored not just what prominent thinkers wrote, but the ""mental toolkit"" available to people of that era, arguing that widespread atheism was conceptually impossible given the prevailing intellectual framework. This focus on the internal worlds and shared cultural frameworks of past societies marked a significant departure from histories centered on rational actors and overt political motivations.

While the Annales School has faced critiques – some argue its structuralism underplays human agency, others find its ""total history"" ambition unwieldy or its later iterations overly fragmented – its impact remains undeniable. It broadened the scope of historical inquiry, legitimized new objects of study, and profoundly influenced historiographical practices globally, compelling historians to look beyond the surface of events to the deeper, slower rhythms of human experience and the material and mental structures that shaped them. Its legacy is evident in fields as diverse as environmental history, microhistory, and the history of everyday life.","Which of the following, if true, would most seriously weaken the Annales School's emphasis on the *longue durée* as described in the passage?","New archival evidence reveals that a series of rapid, decisive political decisions in the 15th century fundamentally altered European agricultural practices for centuries.",Sociological studies confirm that collective mentalities often shift dramatically within a single generation due to influential media.,"Economic historians discover that most significant price fluctuations in pre-modern Europe were directly tied to immediate, short-term weather events.","Anthropological research suggests that cultural beliefs are highly resistant to change, often persisting for millennia despite political or economic shifts.",A,B,C,D,A,MCQ,RC,RC Passage Genre: Humanities & Social Sciences,Hard,Weaken / Strengthen the Argument,question_id: Q4; section: VARC; question_type: MCQ; topic: RC; sub_topic: RC Passage Genre: Humanities & Social Sciences; concept_tested: Weaken / Strengthen the Argument; difficulty_level: Hard; is_tita: false; set_id: MockSet1_VARC; unique_mock_id: 8c1f7a9b3,False,MockSet1_VARC,Evaluation,"A) New archival evidence reveals that a series of rapid, decisive political decisions in the 15th century fundamentally altered European agricultural practices for centuries.
The *longue durée* emphasizes ""slow, almost imperceptible transformations occurring over centuries"" and contrasts with ""short-term froth of events."" If rapid political decisions (short-term events) had fundamental, long-lasting structural impacts, it would challenge the primacy of slow, underlying structures as the main drivers of profound change.
B weakens the idea of stable *mentalités* over the *longue durée* but is less direct to the general concept of *longue durée* itself which also includes geography, climate etc.
C describes short-term events affecting short-term economic phenomena, which doesn't necessarily undermine the *longue durée*'s focus on deeper, long-term structural changes.
D would actually support the idea of certain elements persisting over the *longue durée*."
VARC,40,Q5,5,P2_Emergent,"Emergent behavior is a captivating phenomenon observed across diverse complex systems, from the intricate organization of ant colonies to the synchronized movements of starling murmurations and the complex functionalities of the human brain. It refers to the way complex, high-level patterns and behaviors arise from the collective actions of many individual agents, each following relatively simple rules and interacting primarily with its local neighbors, without any central control or overarching blueprint dictating the global outcome. The sophisticated architecture of a termite mound, for instance, is not the product of a master architect termite, but the cumulative result of countless termites responding to local pheromonal cues and environmental stimuli.

This ""bottom-up"" organization contrasts sharply with traditional reductionist approaches, which seek to understand a system by dissecting it into its constituent parts and studying them in isolation. While reductionism has been remarkably successful in many scientific domains, it often falls short in explaining systems where the interactions between components are as crucial as the components themselves. In emergent systems, the whole is truly more than the sum of its parts; the macroscopic behavior cannot be readily predicted or understood by merely analyzing the individual agents. The characteristic flocking patterns of birds, for example, can be simulated with models where each bird follows simple rules like maintaining a minimum distance from others, matching velocity with neighbors, and moving towards the perceived center of the group. No single bird ""knows"" the flock's overall shape or direction, yet a coherent, adaptive group behavior emerges.

The study of emergence has profound implications. In biology, it helps explain how complex life forms can arise from simpler precursors and how ecosystems maintain stability. In computer science, it underpins concepts in artificial life and swarm robotics, where decentralized systems of simple robots can collectively perform complex tasks. Understanding emergence can also offer insights into social phenomena, like the formation of public opinion or the spontaneous organization of markets. However, a key challenge in studying emergence is its inherent unpredictability at the micro-level; while we can identify the conditions conducive to emergent phenomena, forecasting the precise nature or timing of the emergent patterns often remains elusive. This unpredictability stems from the non-linear interactions and feedback loops that characterize these systems.

Moreover, the concept of emergence forces us to reconsider notions of control and design. Instead of top-down instruction, influencing emergent systems often requires subtle interventions at the level of individual agent rules or their interaction environment. This paradigm shift is critical for tackling complex contemporary challenges, from managing urban growth to mitigating the spread of epidemics, where centralized solutions may be ineffective or counterproductive. The beauty and power of emergence lie in its capacity to generate novelty, adaptation, and resilience from simplicity.",What is the primary purpose of the passage?,To advocate for the universal application of reductionist approaches in scientific inquiry.,To provide a detailed guide for designing and controlling emergent systems in robotics.,"To define emergent behavior, illustrate it with examples, and discuss its characteristics and implications.",To critique the limitations of computer simulations in accurately modeling natural emergent phenomena.,A,B,C,D,C,MCQ,RC,RC Passage Genre: Science & Technology,Medium,Main Idea / Central Theme / Primary Purpose,question_id: Q5; section: VARC; question_type: MCQ; topic: RC; sub_topic: RC Passage Genre: Science & Technology; concept_tested: Main Idea / Central Theme / Primary Purpose; difficulty_level: Medium; is_tita: false; set_id: MockSet1_VARC; unique_mock_id: 8c1f7a9b3,False,MockSet1_VARC,Comprehension,"C) To define emergent behavior, illustrate it with examples, and discuss its characteristics and implications.
The passage defines emergent behavior (para 1), provides examples like termite mounds and bird flocks (para 1, 2), discusses its characteristics (bottom-up, whole greater than sum of parts, para 2), and explores its implications in various fields and challenges (para 3, 4).
A is incorrect; the passage critiques reductionism in the context of emergent systems but doesn't advocate for its universal application.
B is too specific; robotics is mentioned as an application, but it's not a guide.
D is incorrect; simulations are mentioned as a tool (e.g., for flocking) but not critiqued as inaccurate."
