SectionName,SectionTimeLimitMinutes,QuestionUniqueID,QuestionNumberInSection,PassageOrSetID,PassageOrSetContent,QuestionPrompt,OptionAText,OptionBText,OptionCText,OptionDText,OptionAValue,OptionBValue,OptionCValue,OptionDValue,CorrectAnswerValue,QuestionType,Topic,SubTopic,DifficultyLevelPredicted,ConceptTested,DetailedTags,IsTITA,SetID,CognitiveSkillLevel,SolutionExplanation
VARC,40,ag3h5jLp2_Q1,1,P1_Bildungsroman,"The evolution of the bildungsroman, or the coming-of-age novel, presents a fascinating lens through which to observe shifting cultural values. Originating in late 18th-century Germany with Goethe's *Wilhelm Meister's Apprenticeship*, the classic Western bildungsroman traditionally charts the psychological and moral development of a protagonist, typically a young man, from youth to adulthood. This journey often involves a departure from home, a series of formative experiences (often including disillusionment), and an eventual, if sometimes uneasy, integration into society. The emphasis is typically on individual self-discovery and the formation of a unique, autonomous identity, often in tension with, or in opposition to, societal norms before a final reconciliation. This model, deeply rooted in Enlightenment ideals of individualism and self-cultivation, became a staple of European and American literature throughout the 19th and early 20th centuries.

However, as postcolonial literary criticism has highlighted, this individualistic trajectory is not universally representative. In many non-Western literary traditions, the coming-of-age narrative takes a different shape. For instance, in numerous African and South Asian bildungsromans, the protagonist's development is often inextricably linked with the fate of their community or nation, particularly in the context of colonialism and post-colonial nation-building. The ""self"" to be discovered is less an isolated, individuated entity and more a self-in-relation, defined by familial, communal, and national allegiances. The journey is not merely one of personal growth but often one of collective awakening or the shouldering of communal responsibility. Disillusionment, when it occurs, might relate not just to personal ideals but to the broader socio-political landscape.

This divergence does not imply a lesser sophistication in these narratives but rather a different set of cultural priorities and understandings of personhood. While the Western model often culminates in the protagonist finding their unique place *within* or sometimes *against* an existing social order, many postcolonial bildungsromans depict protagonists actively striving to *transform* that order or to forge a new collective identity in the face of historical upheavals. The 'education' in these novels extends beyond personal edification to encompass a political and historical consciousness. The tension is less between individual and society, and more between a colonized or marginalized community and oppressive power structures. This remapping of the bildungsroman from an individual-centric to a community-centric or nation-centric focus reflects a profound re-evaluation of what constitutes a meaningful life and a mature self in diverse cultural and historical settings. The narrative arc is thus not simply an import but a re-inscription, charged with local significances and historical imperatives.","On the basis of the nature of the relationship between the items in each pair below, choose the odd pair out:",Western bildungsroman : Individual self-discovery,Postcolonial bildungsroman : Collective awakening,Enlightenment ideals : Autonomous identity,German bildungsroman : Communal responsibility,1,2,3,4,4,MCQ,RC,RC Passage Genre: Humanities & Social Sciences,Medium,Understanding Relationships,"Bildungsroman, Western Literature, Postcolonial Literature, Individualism, Collectivism, Enlightenment",False,MockSet1_VARC,Analysis,"The passage defines the classic Western bildungsroman, which originated in Germany (Goethe), as focusing on ""individual self-discovery"" and an ""autonomous identity"" (Paragraph 1). Postcolonial bildungsromans, in contrast, link development to ""community or nation"" (Paragraph 2). Pair [1] is consistent. Pair [2] is consistent. Pair [3] links Enlightenment ideals to individualism, which the passage associates with the Western bildungsroman. Pair [4] incorrectly links the German (classic Western) model with ""communal responsibility"" as its primary defining characteristic, which is attributed to the postcolonial model."
VARC,40,ag3h5jLp2_Q2,2,P1_Bildungsroman,"The evolution of the bildungsroman, or the coming-of-age novel, presents a fascinating lens through which to observe shifting cultural values. Originating in late 18th-century Germany with Goethe's *Wilhelm Meister's Apprenticeship*, the classic Western bildungsroman traditionally charts the psychological and moral development of a protagonist, typically a young man, from youth to adulthood. This journey often involves a departure from home, a series of formative experiences (often including disillusionment), and an eventual, if sometimes uneasy, integration into society. The emphasis is typically on individual self-discovery and the formation of a unique, autonomous identity, often in tension with, or in opposition to, societal norms before a final reconciliation. This model, deeply rooted in Enlightenment ideals of individualism and self-cultivation, became a staple of European and American literature throughout the 19th and early 20th centuries.

However, as postcolonial literary criticism has highlighted, this individualistic trajectory is not universally representative. In many non-Western literary traditions, the coming-of-age narrative takes a different shape. For instance, in numerous African and South Asian bildungsromans, the protagonist's development is often inextricably linked with the fate of their community or nation, particularly in the context of colonialism and post-colonial nation-building. The ""self"" to be discovered is less an isolated, individuated entity and more a self-in-relation, defined by familial, communal, and national allegiances. The journey is not merely one of personal growth but often one of collective awakening or the shouldering of communal responsibility. Disillusionment, when it occurs, might relate not just to personal ideals but to the broader socio-political landscape.

This divergence does not imply a lesser sophistication in these narratives but rather a different set of cultural priorities and understandings of personhood. While the Western model often culminates in the protagonist finding their unique place *within* or sometimes *against* an existing social order, many postcolonial bildungsromans depict protagonists actively striving to *transform* that order or to forge a new collective identity in the face of historical upheavals. The 'education' in these novels extends beyond personal edification to encompass a political and historical consciousness. The tension is less between individual and society, and more between a colonized or marginalized community and oppressive power structures. This remapping of the bildungsroman from an individual-centric to a community-centric or nation-centric focus reflects a profound re-evaluation of what constitutes a meaningful life and a mature self in diverse cultural and historical settings. The narrative arc is thus not simply an import but a re-inscription, charged with local significances and historical imperatives.","All of the following statements, if true, would weaken the passage's claims about the primary distinctions between Western and postcolonial bildungsromans EXCEPT:",Many 19th-century European bildungsromans depict protagonists whose personal development is deeply intertwined with nationalistic movements and societal reforms.,"Recent scholarship on postcolonial bildungsromans reveals a growing trend towards narratives focusing on purely individualistic psychological journeys, detached from political contexts.","Several influential postcolonial bildungsromans conclude with the protagonist achieving personal success by assimilating into the colonial establishment, rather than transforming it.","The earliest German bildungsromans, while focusing on individual development, often framed this development within the context of the protagonist's duties to their local community and state.",1,2,3,4,4,MCQ,RC,RC Passage Genre: Humanities & Social Sciences,Hard,Weaken / Strengthen the Argument,"Bildungsroman, Western vs Postcolonial, Literary Criticism, Argument Analysis, Weaken EXCEPT",False,MockSet1_VARC,Critical Thinking,"The passage distinguishes Western bildungsromans (individual focus, eventual reconciliation with society) from postcolonial ones (development inextricably linked with community/nation from the start, often aiming to transform society).
[1] Weakens the distinction by making the Western model more like the postcolonial model in its direct engagement with national/societal issues.
[2] Weakens the distinction by suggesting postcolonial novels are becoming more like the Western individualistic model.
[3] Weakens the distinction by contradicting the transformative, collective aim attributed to postcolonial protagonists.
[4] This statement does NOT significantly weaken the primary distinction. While it adds nuance to the Western model, the core remains ""focusing on individual development."" The framing within ""duties"" can be seen as part of the ""eventual...integration into society"" mentioned for the Western model, without making the individual's development *dependent on* or *primarily driven by* collective fate, which is the hallmark of the postcolonial model described. The primary thrust remains individual, even if contextualized by societal duties."
VARC,40,ag3h5jLp2_Q3,3,P1_Bildungsroman,"The evolution of the bildungsroman, or the coming-of-age novel, presents a fascinating lens through which to observe shifting cultural values. Originating in late 18th-century Germany with Goethe's *Wilhelm Meister's Apprenticeship*, the classic Western bildungsroman traditionally charts the psychological and moral development of a protagonist, typically a young man, from youth to adulthood. This journey often involves a departure from home, a series of formative experiences (often including disillusionment), and an eventual, if sometimes uneasy, integration into society. The emphasis is typically on individual self-discovery and the formation of a unique, autonomous identity, often in tension with, or in opposition to, societal norms before a final reconciliation. This model, deeply rooted in Enlightenment ideals of individualism and self-cultivation, became a staple of European and American literature throughout the 19th and early 20th centuries.

However, as postcolonial literary criticism has highlighted, this individualistic trajectory is not universally representative. In many non-Western literary traditions, the coming-of-age narrative takes a different shape. For instance, in numerous African and South Asian bildungsromans, the protagonist's development is often inextricably linked with the fate of their community or nation, particularly in the context of colonialism and post-colonial nation-building. The ""self"" to be discovered is less an isolated, individuated entity and more a self-in-relation, defined by familial, communal, and national allegiances. The journey is not merely one of personal growth but often one of collective awakening or the shouldering of communal responsibility. Disillusionment, when it occurs, might relate not just to personal ideals but to the broader socio-political landscape.

This divergence does not imply a lesser sophistication in these narratives but rather a different set of cultural priorities and understandings of personhood. While the Western model often culminates in the protagonist finding their unique place *within* or sometimes *against* an existing social order, many postcolonial bildungsromans depict protagonists actively striving to *transform* that order or to forge a new collective identity in the face of historical upheavals. The 'education' in these novels extends beyond personal edification to encompass a political and historical consciousness. The tension is less between individual and society, and more between a colonized or marginalized community and oppressive power structures. This remapping of the bildungsroman from an individual-centric to a community-centric or nation-centric focus reflects a profound re-evaluation of what constitutes a meaningful life and a mature self in diverse cultural and historical settings. The narrative arc is thus not simply an import but a re-inscription, charged with local significances and historical imperatives.","Which one of the following statements is not true about the coming-of-age narrative, according to the passage?",The protagonist's journey in a classic Western bildungsroman often involves a degree of conflict with societal expectations before a final integration.,The development of a political and historical consciousness is more central to the protagonist's 'education' in postcolonial bildungsromans than in classic Western ones.,The Western bildungsroman model is primarily concerned with the protagonist's struggle against oppressive colonial power structures.,"In many non-Western literary traditions, the concept of self is often understood in relation to family, community, or nation.",1,2,3,4,3,MCQ,RC,RC Passage Genre: Humanities & Social Sciences,Medium,Supporting Idea / Detail Based,"Bildungsroman, Coming-of-Age Narrative, Western Literature, Postcolonial Literature, Detail Identification",False,MockSet1_VARC,Comprehension,"The passage states (Paragraph 3): ""The tension is less between individual and society [in postcolonial bildungsromans], and more between a colonized or marginalized community and oppressive power structures."" This clearly attributes the struggle against colonial power structures to postcolonial bildungsromans, not Western ones.
[1] is true: ""often in tension with...societal norms before a final reconciliation."" (Paragraph 1)
[2] is true: ""The 'education' in these novels extends beyond personal edification to encompass a political and historical consciousness."" (Paragraph 3) This is said of postcolonial novels, implying it's a key difference from Western ones.
[4] is true: ""...the protagonist's development is often inextricably linked with the fate of their community or nation...a self-in-relation..."" (Paragraph 2)"
VARC,40,ag3h5jLp2_Q5,5,P2_Rewilding,"The burgeoning field of rewilding, which aims to restore ecosystems to a more natural, self-regulating state, often by reintroducing keystone species, is fraught with ecological and social complexities. While proponents highlight successes such as the reintroduction of wolves to Yellowstone National Park, which led to a trophic cascade benefiting various flora and fauna, the path to successful rewilding is neither straightforward nor universally applicable. The very definition of ""natural"" or ""original"" state is often a subject of debate, particularly in landscapes long altered by human activity.

One significant challenge is the ""shifting baseline syndrome,"" where each generation perceives the degraded state of the environment they grew up in as the norm, making it difficult to establish ambitious yet realistic restoration goals. For instance, a rewilding project in the Scottish Highlands aiming to restore the Caledonian Forest must contend with centuries of deforestation and sheep grazing that have fundamentally altered soil composition and hydrology. Simply reintroducing native tree species may not suffice without addressing these underlying ecological changes and the socio-economic factors, such as local communities' dependence on sheep farming, that maintain the current landscape.

Ethical considerations also loom large. The reintroduction of large carnivores, while ecologically beneficial in some contexts, can lead to conflicts with human populations, particularly agricultural communities. The reintroduction of beavers in parts of Europe, for example, has been lauded for creating wetland habitats and mitigating floods, but has also resulted in localized flooding of farmland, sparking opposition. Balancing ecological restoration with human livelihoods and safety requires careful planning, stakeholder engagement, and often, compensatory mechanisms. Furthermore, the focus on charismatic megafauna can sometimes divert attention and resources from less glamorous but equally crucial conservation efforts targeting smaller species or habitat restoration.

Moreover, the notion of ""wilderness"" itself, central to many rewilding ideologies, is often a human construct. Many landscapes perceived as ""wild"" have, in fact, been shaped by indigenous human activity for millennia. Ignoring this historical human role can lead to rewilding projects that, ironically, erase cultural landscapes and displace communities whose traditional practices contributed to the biodiversity the projects now seek to restore. A truly holistic approach to rewilding must therefore integrate ecological science with social justice, acknowledging that humans are not always separate from, but can be integral to, thriving ecosystems. The success of rewilding, ultimately, may depend less on recreating a mythical pristine past and more on fostering resilient, co-existing socio-ecological systems for the future.",The examples of the Caledonian Forest and beaver reintroduction are offered in the passage primarily to show that:,rewilding projects are often more successful in forested areas than in agricultural landscapes.,the reintroduction of keystone species is the most critical component of any successful rewilding initiative.,ecological restoration through rewilding can face significant challenges from historical land use and contemporary human interests.,the primary opposition to rewilding projects stems from a lack of understanding of their long-term ecological benefits.,1,2,3,4,3,MCQ,RC,RC Passage Genre: Science & Environment/Technology,Medium,Application / Extrapolation,"Rewilding, Ecological Restoration, Caledonian Forest, Beaver Reintroduction, Challenges, Human Impact",False,MockSet1_VARC,Comprehension,"The Caledonian Forest example (Paragraph 2) illustrates challenges due to ""centuries of deforestation and sheep grazing"" (historical land use) and ""socio-economic factors, such as local communities' dependence on sheep farming"" (contemporary human interests). The beaver reintroduction (Paragraph 3) highlights conflict with ""farmland"" (contemporary human interests).
[1] is a generalization not directly supported as the primary point of these specific examples.
[2] is a goal of rewilding, but the examples illustrate obstacles to achieving it.
[4] is not supported; farmer opposition to beavers is due to practical issues like flooding, not necessarily a lack of understanding of ecological benefits."
VARC,40,ag3h5jLp2_Q6,6,P2_Rewilding,"The burgeoning field of rewilding, which aims to restore ecosystems to a more natural, self-regulating state, often by reintroducing keystone species, is fraught with ecological and social complexities. While proponents highlight successes such as the reintroduction of wolves to Yellowstone National Park, which led to a trophic cascade benefiting various flora and fauna, the path to successful rewilding is neither straightforward nor universally applicable. The very definition of ""natural"" or ""original"" state is often a subject of debate, particularly in landscapes long altered by human activity.

One significant challenge is the ""shifting baseline syndrome,"" where each generation perceives the degraded state of the environment they grew up in as the norm, making it difficult to establish ambitious yet realistic restoration goals. For instance, a rewilding project in the Scottish Highlands aiming to restore the Caledonian Forest must contend with centuries of deforestation and sheep grazing that have fundamentally altered soil composition and hydrology. Simply reintroducing native tree species may not suffice without addressing these underlying ecological changes and the socio-economic factors, such as local communities' dependence on sheep farming, that maintain the current landscape.

Ethical considerations also loom large. The reintroduction of large carnivores, while ecologically beneficial in some contexts, can lead to conflicts with human populations, particularly agricultural communities. The reintroduction of beavers in parts of Europe, for example, has been lauded for creating wetland habitats and mitigating floods, but has also resulted in localized flooding of farmland, sparking opposition. Balancing ecological restoration with human livelihoods and safety requires careful planning, stakeholder engagement, and often, compensatory mechanisms. Furthermore, the focus on charismatic megafauna can sometimes divert attention and resources from less glamorous but equally crucial conservation efforts targeting smaller species or habitat restoration.

Moreover, the notion of ""wilderness"" itself, central to many rewilding ideologies, is often a human construct. Many landscapes perceived as ""wild"" have, in fact, been shaped by indigenous human activity for millennia. Ignoring this historical human role can lead to rewilding projects that, ironically, erase cultural landscapes and displace communities whose traditional practices contributed to the biodiversity the projects now seek to restore. A truly holistic approach to rewilding must therefore integrate ecological science with social justice, acknowledging that humans are not always separate from, but can be integral to, thriving ecosystems. The success of rewilding, ultimately, may depend less on recreating a mythical pristine past and more on fostering resilient, co-existing socio-ecological systems for the future.",All of the following can be inferred from the passage as challenges or criticisms related to rewilding EXCEPT:,Rewilding initiatives may inadvertently prioritize certain high-profile species over other vital conservation needs.,The historical ecological baseline for rewilding projects can be difficult to define and achieve due to long-term environmental modifications.,Rewilding efforts are often hampered by a lack of scientific understanding of trophic cascades and ecosystem dynamics.,Some rewilding projects might neglect the historical role of indigenous communities in shaping and maintaining local biodiversity.,1,2,3,4,3,MCQ,RC,RC Passage Genre: Science & Environment/Technology,Medium,Inference / Implied Meaning,"Rewilding, Challenges, Criticisms, Conservation, Trophic Cascades, Indigenous Communities",False,MockSet1_VARC,Inference,"The passage cites the Yellowstone wolf reintroduction as a *success* that led to a trophic cascade (Paragraph 1). It does not suggest that a general lack of understanding of these dynamics is a primary challenge; rather, it focuses on issues like defining baselines, ethical conflicts, and the human construct of wilderness.
[1] is stated: ""the focus on charismatic megafauna can sometimes divert attention and resources..."" (Paragraph 3).
[2] is stated: ""...'shifting baseline syndrome,' where each generation perceives the degraded state...as the norm..."" (Paragraph 2).
[4] is stated: ""Many landscapes perceived as 'wild' have, in fact, been shaped by indigenous human activity... Ignoring this historical human role..."" (Paragraph 4)."
