SectionName,SectionTimeLimitMinutes,QuestionUniqueID,QuestionNumberInSection,PassageOrSetID,PassageOrSetContent,QuestionPrompt,OptionAText,OptionBText,OptionCText,OptionDText,OptionAValue,OptionBValue,OptionCValue,OptionDValue,CorrectAnswerValue,QuestionType,Topic,SubTopic,DifficultyLevelPredicted,ConceptTested,DetailedTags,IsTITA,SetID,CognitiveSkillLevel,SolutionExplanation
VARC,40,Q11,11,P3_SustainableDev,"The concept of ""sustainable development,"" popularized by the 1987 Brundtland Commission Report, ""Our Common Future,"" entered the global lexicon with laudable ambition: ""development that meets the needs of the present without compromising the ability of future generations to meet their own needs."" This definition sought to bridge the perceived chasm between economic growth and environmental protection, proposing a tripartite framework encompassing economic, social, and environmental pillars as interconnected and interdependent. For decades, it has served as a guiding principle for international policy, corporate responsibility initiatives, and developmental aid, ostensibly offering a pathway to prosperity that respects planetary boundaries.

However, the very breadth and inherent optimism of ""sustainable development"" have also rendered it susceptible to critique. One major line of criticism points to its operational vagueness. What constitutes ""needs""? How are trade-offs between the three pillars to be managed when they inevitably conflict? The lack of precise metrics and clear prioritization mechanisms has allowed disparate actors to interpret and implement ""sustainable development"" in ways that serve their pre-existing agendas. Consequently, critics argue, the term has often been co-opted, becoming a veneer of ""greenwashing"" for corporations continuing environmentally damaging practices, or a rhetorical device for governments reluctant to make hard choices that might constrain short-term economic expansion.

Furthermore, a more fundamental critique questions the compatibility of continuous economic growth, a central tenet of most development models, with genuine long-term environmental sustainability. Proponents of ""green growth"" or ""eco-modernism"" argue that technological innovation and market mechanisms can decouple economic growth from resource depletion and environmental degradation. However, skeptics point to the Jevons paradox – where increased efficiency in resource use can lead to increased overall consumption – and the sheer scale of global material throughput, suggesting that absolute decoupling is, at best, a distant hope rather than a current reality. They contend that a truly sustainable future may necessitate a rethinking of growth-centric economic paradigms, a notion that challenges the core assumptions underpinning much of the sustainable development discourse.

Despite these trenchant criticisms, the concept of sustainable development endures, partly because it articulates a powerful and necessary aspiration. It keeps the vital conversation about intergenerational equity and the planet's limits on the agenda. The challenge lies not in abandoning the ideal, but in imbuing it with more rigorous frameworks, transparent accountability, and a willingness to confront the systemic changes required to translate its promise into reality, moving beyond rhetoric to substantive action that genuinely prioritizes ecological integrity and social equity alongside economic considerations.","The passage mentions all of the following as criticisms or challenges related to ""sustainable development"" EXCEPT:",its operational vagueness and lack of precise metrics.,its complete rejection by major international policymaking bodies.,"its potential for co-option by corporate interests for ""greenwashing.""",the fundamental tension between continuous economic growth and environmental limits.,A,B,C,D,B,MCQ,RC,RC Passage Genre: Economics & Business,Medium,Supporting Idea / Detail Based,question_id: Q11; section: VARC; question_type: MCQ; topic: RC; sub_topic: RC Passage Genre: Economics & Business; concept_tested: Supporting Idea / Detail Based; difficulty_level: Medium; is_tita: false; set_id: MockSet1_VARC; unique_mock_id: 8c1f7a9b3,False,MockSet1_VARC,Comprehension,"B) its complete rejection by major international policymaking bodies.
The passage states it ""has served as a guiding principle for international policy"" (para 1), implying adoption, not rejection.
A is mentioned in para 2 (""operational vagueness,"" ""lack of precise metrics"").
C is mentioned in para 2 (""veneer of 'greenwashing'"").
D is discussed in para 3 (tension between continuous economic growth and environmental sustainability)."
VARC,40,Q12,12,P3_SustainableDev,"The concept of ""sustainable development,"" popularized by the 1987 Brundtland Commission Report, ""Our Common Future,"" entered the global lexicon with laudable ambition: ""development that meets the needs of the present without compromising the ability of future generations to meet their own needs."" This definition sought to bridge the perceived chasm between economic growth and environmental protection, proposing a tripartite framework encompassing economic, social, and environmental pillars as interconnected and interdependent. For decades, it has served as a guiding principle for international policy, corporate responsibility initiatives, and developmental aid, ostensibly offering a pathway to prosperity that respects planetary boundaries.

However, the very breadth and inherent optimism of ""sustainable development"" have also rendered it susceptible to critique. One major line of criticism points to its operational vagueness. What constitutes ""needs""? How are trade-offs between the three pillars to be managed when they inevitably conflict? The lack of precise metrics and clear prioritization mechanisms has allowed disparate actors to interpret and implement ""sustainable development"" in ways that serve their pre-existing agendas. Consequently, critics argue, the term has often been co-opted, becoming a veneer of ""greenwashing"" for corporations continuing environmentally damaging practices, or a rhetorical device for governments reluctant to make hard choices that might constrain short-term economic expansion.

Furthermore, a more fundamental critique questions the compatibility of continuous economic growth, a central tenet of most development models, with genuine long-term environmental sustainability. Proponents of ""green growth"" or ""eco-modernism"" argue that technological innovation and market mechanisms can decouple economic growth from resource depletion and environmental degradation. However, skeptics point to the Jevons paradox – where increased efficiency in resource use can lead to increased overall consumption – and the sheer scale of global material throughput, suggesting that absolute decoupling is, at best, a distant hope rather than a current reality. They contend that a truly sustainable future may necessitate a rethinking of growth-centric economic paradigms, a notion that challenges the core assumptions underpinning much of the sustainable development discourse.

Despite these trenchant criticisms, the concept of sustainable development endures, partly because it articulates a powerful and necessary aspiration. It keeps the vital conversation about intergenerational equity and the planet's limits on the agenda. The challenge lies not in abandoning the ideal, but in imbuing it with more rigorous frameworks, transparent accountability, and a willingness to confront the systemic changes required to translate its promise into reality, moving beyond rhetoric to substantive action that genuinely prioritizes ecological integrity and social equity alongside economic considerations.","Which of the following, if true, would most directly challenge the skeptics' view on ""absolute decoupling"" mentioned in paragraph 3?",Global resource consumption has continued to rise despite significant improvements in resource efficiency in several key industries over the past decade.,"A new suite of technologies is developed that allows for the production of all essential goods using 90% less raw material and emitting near-zero carbon, with widespread, affordable adoption globally.","Many developing nations argue that their priority is immediate economic growth, even if it entails short-term environmental costs.",Political theorists demonstrate that growth-centric economic paradigms are deeply embedded in modern societal values.,A,B,C,D,B,MCQ,RC,RC Passage Genre: Economics & Business,Hard,Weaken / Strengthen the Argument,question_id: Q12; section: VARC; question_type: MCQ; topic: RC; sub_topic: RC Passage Genre: Economics & Business; concept_tested: Weaken / Strengthen the Argument; difficulty_level: Hard; is_tita: false; set_id: MockSet1_VARC; unique_mock_id: 8c1f7a9b3,False,MockSet1_VARC,Evaluation,"B) A new suite of technologies is developed that allows for the production of all essential goods using 90% less raw material and emitting near-zero carbon, with widespread, affordable adoption globally.
Skeptics (para 3) doubt ""absolute decoupling"" (economic growth without increased resource use/degradation). If technologies enable massive reduction in material/energy use per unit of economic output on a global scale, this would directly demonstrate that such decoupling is possible, challenging the skeptics.
A would support the skeptics' view (Jevons paradox idea).
C and D relate to priorities and values but don't directly address the technological possibility of decoupling."
VARC,40,Q13,13,P4_BerlinLiberty,"Isaiah Berlin’s 1958 lecture, ""Two Concepts of Liberty,"" remains a seminal text in modern political philosophy, articulating a crucial distinction between ""negative"" and ""positive"" freedom that continues to shape debates about the nature and limits of individual liberty and state authority. Berlin, wary of the historical trajectory of utopian ideals turning tyrannical, sought to delineate these concepts with care, highlighting the potential perils he associated primarily with an uncritical embrace of positive liberty.

Negative liberty, in Berlin’s formulation, is essentially ""freedom from"": freedom from interference, coercion, or constraint imposed by other people or by the state. It defines an area within which an individual can act unobstructed. The extent of one's negative liberty is determined by how many doors are open, how wide they are, and how unmolested one is in pursuing one's chosen paths within that domain. This concept aligns with classical liberal thought, emphasizing the importance of individual rights, limited government, and the protection of a private sphere where state intervention is minimized. For Berlin, a certain minimum area of personal freedom was sacrosanct, indispensable for the development of human faculties and the pursuit of diverse, often conflicting, human ends.

Positive liberty, conversely, is ""freedom to"": the freedom to be one's own master, to act according to reason, to achieve self-realization or self-determination. It is concerned not merely with the absence of external obstacles but with the presence of conditions that enable individuals to pursue their ""true"" or ""higher"" selves. While this aspiration for self-mastery is intuitively appealing, Berlin harbored deep suspicions about its potential political misapplication. He argued that the notion of a ""true self"" could be easily co-opted by those in power, who might then claim to know what is best for individuals better than the individuals themselves. This could lead to a paternalistic, or even authoritarian, state justifying coercion in the name of helping citizens achieve their ""real"" freedom, effectively forcing them to be free. This, for Berlin, was the slippery slope from an ideal of individual self-direction to collective control and oppression.

Berlin did not outright reject positive liberty as a personal ideal but was profoundly cautious about its institutionalization as a political goal, especially when it involved a singular, monolithic conception of the human good. He feared that the pursuit of a collective positive liberty could readily override individual negative liberties, sacrificing the actual, diverse freedoms of individuals at the altar of an abstract, imposed ideal. His analysis serves as a persistent reminder of the complexities inherent in defining freedom and the constant vigilance required to protect it from both overt oppression and well-intentioned, but ultimately dangerous, paternalism.",The passage is primarily concerned with:,advocating for the complete abandonment of the concept of positive liberty.,outlining Isaiah Berlin's distinction between negative and positive liberty and his concerns about the latter.,tracing the historical development of liberal thought from John Locke to Isaiah Berlin.,"proposing a new, third concept of liberty that synthesizes negative and positive freedom.",A,B,C,D,B,MCQ,RC,RC Passage Genre: Abstract & Philosophical,Medium,Main Idea / Central Theme / Primary Purpose,question_id: Q13; section: VARC; question_type: MCQ; topic: RC; sub_topic: RC Passage Genre: Abstract & Philosophical; concept_tested: Main Idea / Central Theme / Primary Purpose; difficulty_level: Medium; is_tita: false; set_id: MockSet1_VARC; unique_mock_id: 8c1f7a9b3,False,MockSet1_VARC,Comprehension,"B) outlining Isaiah Berlin's distinction between negative and positive liberty and his concerns about the latter.
The passage introduces Berlin's ""Two Concepts of Liberty"" (para 1), defines negative liberty (para 2), defines positive liberty and Berlin's suspicions about it (para 3), and summarizes his cautious stance (para 4).
A is too strong; Berlin was ""cautious"" about positive liberty's political institutionalization, not advocating for its ""complete abandonment"" as a personal ideal.
C is too broad; the focus is specifically on Berlin's concepts.
D is not mentioned in the passage."
VARC,40,Q14,14,P4_BerlinLiberty,"Isaiah Berlin’s 1958 lecture, ""Two Concepts of Liberty,"" remains a seminal text in modern political philosophy, articulating a crucial distinction between ""negative"" and ""positive"" freedom that continues to shape debates about the nature and limits of individual liberty and state authority. Berlin, wary of the historical trajectory of utopian ideals turning tyrannical, sought to delineate these concepts with care, highlighting the potential perils he associated primarily with an uncritical embrace of positive liberty.

Negative liberty, in Berlin’s formulation, is essentially ""freedom from"": freedom from interference, coercion, or constraint imposed by other people or by the state. It defines an area within which an individual can act unobstructed. The extent of one's negative liberty is determined by how many doors are open, how wide they are, and how unmolested one is in pursuing one's chosen paths within that domain. This concept aligns with classical liberal thought, emphasizing the importance of individual rights, limited government, and the protection of a private sphere where state intervention is minimized. For Berlin, a certain minimum area of personal freedom was sacrosanct, indispensable for the development of human faculties and the pursuit of diverse, often conflicting, human ends.

Positive liberty, conversely, is ""freedom to"": the freedom to be one's own master, to act according to reason, to achieve self-realization or self-determination. It is concerned not merely with the absence of external obstacles but with the presence of conditions that enable individuals to pursue their ""true"" or ""higher"" selves. While this aspiration for self-mastery is intuitively appealing, Berlin harbored deep suspicions about its potential political misapplication. He argued that the notion of a ""true self"" could be easily co-opted by those in power, who might then claim to know what is best for individuals better than the individuals themselves. This could lead to a paternalistic, or even authoritarian, state justifying coercion in the name of helping citizens achieve their ""real"" freedom, effectively forcing them to be free. This, for Berlin, was the slippery slope from an ideal of individual self-direction to collective control and oppression.

Berlin did not outright reject positive liberty as a personal ideal but was profoundly cautious about its institutionalization as a political goal, especially when it involved a singular, monolithic conception of the human good. He feared that the pursuit of a collective positive liberty could readily override individual negative liberties, sacrificing the actual, diverse freedoms of individuals at the altar of an abstract, imposed ideal. His analysis serves as a persistent reminder of the complexities inherent in defining freedom and the constant vigilance required to protect it from both overt oppression and well-intentioned, but ultimately dangerous, paternalism.","It can be inferred from the passage that Isaiah Berlin would likely view a government that mandates participation in ""civic improvement"" programs for all citizens, believing these programs cultivate a ""better, more engaged"" populace, with:","unqualified approval, as it promotes self-realization.","indifference, as it does not directly relate to economic freedom.","suspicion, due to its potential to impose a collective notion of the good and infringe upon individual choice.","support, provided the programs are democratically decided and popular.",A,B,C,D,C,MCQ,RC,RC Passage Genre: Abstract & Philosophical,Hard,Inference / Implied Meaning,question_id: Q14; section: VARC; question_type: MCQ; topic: RC; sub_topic: RC Passage Genre: Abstract & Philosophical; concept_tested: Inference / Implied Meaning; difficulty_level: Hard; is_tita: false; set_id: MockSet1_VARC; unique_mock_id: 8c1f7a9b3,False,MockSet1_VARC,Analysis,"C) suspicion, due to its potential to impose a collective notion of the good and infringe upon individual choice.
Berlin's concern with positive liberty was that ""the notion of a 'true self' could be easily co-opted by those in power, who might then claim to know what is best for individuals... This could lead to a paternalistic, or even authoritarian, state justifying coercion"" (para 3). Mandating programs to create a ""better"" populace fits this pattern of imposing a collective good.
A is incorrect, as this is the kind of scenario Berlin was wary of.
B is incorrect; the issue is about fundamental liberty, not just economic.
D is incorrect; Berlin's concern was about the nature of such power, regardless of its democratic origin, if it led to imposing a single version of the good."
VARC,40,Q15,15,P4_BerlinLiberty,"Isaiah Berlin’s 1958 lecture, ""Two Concepts of Liberty,"" remains a seminal text in modern political philosophy, articulating a crucial distinction between ""negative"" and ""positive"" freedom that continues to shape debates about the nature and limits of individual liberty and state authority. Berlin, wary of the historical trajectory of utopian ideals turning tyrannical, sought to delineate these concepts with care, highlighting the potential perils he associated primarily with an uncritical embrace of positive liberty.

Negative liberty, in Berlin’s formulation, is essentially ""freedom from"": freedom from interference, coercion, or constraint imposed by other people or by the state. It defines an area within which an individual can act unobstructed. The extent of one's negative liberty is determined by how many doors are open, how wide they are, and how unmolested one is in pursuing one's chosen paths within that domain. This concept aligns with classical liberal thought, emphasizing the importance of individual rights, limited government, and the protection of a private sphere where state intervention is minimized. For Berlin, a certain minimum area of personal freedom was sacrosanct, indispensable for the development of human faculties and the pursuit of diverse, often conflicting, human ends.

Positive liberty, conversely, is ""freedom to"": the freedom to be one's own master, to act according to reason, to achieve self-realization or self-determination. It is concerned not merely with the absence of external obstacles but with the presence of conditions that enable individuals to pursue their ""true"" or ""higher"" selves. While this aspiration for self-mastery is intuitively appealing, Berlin harbored deep suspicions about its potential political misapplication. He argued that the notion of a ""true self"" could be easily co-opted by those in power, who might then claim to know what is best for individuals better than the individuals themselves. This could lead to a paternalistic, or even authoritarian, state justifying coercion in the name of helping citizens achieve their ""real"" freedom, effectively forcing them to be free. This, for Berlin, was the slippery slope from an ideal of individual self-direction to collective control and oppression.

Berlin did not outright reject positive liberty as a personal ideal but was profoundly cautious about its institutionalization as a political goal, especially when it involved a singular, monolithic conception of the human good. He feared that the pursuit of a collective positive liberty could readily override individual negative liberties, sacrificing the actual, diverse freedoms of individuals at the altar of an abstract, imposed ideal. His analysis serves as a persistent reminder of the complexities inherent in defining freedom and the constant vigilance required to protect it from both overt oppression and well-intentioned, but ultimately dangerous, paternalism.","According to the passage, negative liberty is characterized by:",the active provision of resources by the state to enable individual achievement.,an individual's capacity for rational self-governance and moral development.,the absence of external impediments to an individual's actions.,"a societal consensus on what constitutes the ""true"" or ""higher"" purpose of human life.",A,B,C,D,C,MCQ,RC,RC Passage Genre: Abstract & Philosophical,Easy,Supporting Idea / Detail Based,question_id: Q15; section: VARC; question_type: MCQ; topic: RC; sub_topic: RC Passage Genre: Abstract & Philosophical; concept_tested: Supporting Idea / Detail Based; difficulty_level: Easy; is_tita: false; set_id: MockSet1_VARC; unique_mock_id: 8c1f7a9b3,False,MockSet1_VARC,Comprehension,"C) the absence of external impediments to an individual's actions.
Paragraph 2 defines negative liberty as ""freedom from: freedom from interference, coercion, or constraint imposed by other people or by the state. It defines an area within which an individual can act unobstructed.""
A describes a characteristic often associated with enabling positive liberty.
B is a definition of positive liberty (""freedom to be one's own master, to act according to reason"").
D relates to the problematic aspect Berlin saw in some interpretations of positive liberty."
