SectionName,SectionTimeLimitMinutes,QuestionUniqueID,QuestionNumberInSection,PassageOrSetID,PassageOrSetContent,QuestionPrompt,OptionAText,OptionBText,OptionCText,OptionDText,OptionAValue,OptionBValue,OptionCValue,OptionDValue,CorrectAnswerValue,QuestionType,Topic,SubTopic,DifficultyLevelPredicted,ConceptTested,DetailedTags,IsTITA,SetID,CognitiveSkillLevel,SolutionExplanation
VARC,40,Q6,6,P2_WildlifeCorridors,"The rapid expansion of urban landscapes worldwide presents a formidable challenge to biodiversity, fragmenting natural habitats and isolating wildlife populations. In response, conservationists and urban planners have increasingly championed the concept of urban wildlife corridors – strips of habitat, often linear, designed to connect larger, isolated patches of green space. These corridors aim to facilitate the movement of animals, allowing for genetic exchange between populations, access to diverse resources, and recolonization of empty habitats, thereby mitigating some of the deleterious effects of urbanization. The theoretical underpinnings are sound: by maintaining connectivity, corridors can enhance the viability of metapopulations and bolster the ecological resilience of urban ecosystems.

However, the practical implementation and effectiveness of urban wildlife corridors are fraught with complexities. Designing functional corridors requires careful consideration of the target species, as a path suitable for a raccoon may be entirely inadequate for a deer or a ground-nesting bird. The width, length, vegetation structure, and degree of human disturbance within a corridor are critical variables. Narrow or poorly vegetated corridors may act as ""ecological traps,"" luring animals into suboptimal or dangerous environments where they face increased predation or mortality from vehicular collisions. Furthermore, the ""edge effects"" – alterations in environmental conditions at the boundary of habitats – can be pronounced in linear corridors, potentially negating their benefits for sensitive interior species.

Securing land for corridors in densely populated urban areas is another significant hurdle, often involving intricate negotiations with private landowners and substantial financial investment. Public acceptance and participation are also crucial; corridors that traverse residential areas require community buy-in to minimize human-wildlife conflict and ensure that adjacent land management practices are conducive to wildlife movement. For example, the use of pesticides in nearby gardens or the presence of free-roaming domestic pets can severely compromise a corridor's utility.

Despite these challenges, successful examples of urban wildlife corridors exist, demonstrating tangible benefits for local fauna. Studies have shown increased movement and gene flow for certain species, and corridors can also provide ancillary ecosystem services, such as improved air and water quality, and recreational opportunities for urban dwellers. The key to success often lies in adaptive management – continuously monitoring corridor use by wildlife and adjusting design and management strategies accordingly – and integrating corridor planning into broader regional conservation strategies rather than treating them as standalone solutions. Ultimately, while not a panacea, thoughtfully designed and managed urban wildlife corridors represent a vital tool in the ongoing effort to reconcile urban development with biodiversity conservation.","The passage suggests that an urban wildlife corridor is more likely to be an ""ecological trap"" if it:",is very wide and heavily vegetated.,"connects large, pristine natural areas.",is narrow and offers insufficient protection or resources.,is primarily used by highly adaptable species like raccoons.,A,B,C,D,C,MCQ,RC,RC Passage Genre: Science & Technology,Medium,Inference / Implied Meaning,"question_id:Q6, section:VARC, question_type:MCQ, topic:RC, sub_topic:RC Passage Genre: Science & Technology, concept_tested:Inference / Implied Meaning, difficulty_level:Medium, is_tita:false, set_id:MockSet1_VARC, unique_mock_id:8f9a0c1b2",False,MockSet1_VARC,Analyzing,"Paragraph 2 states: ""Narrow or poorly vegetated corridors may act as 'ecological traps,' luring animals into suboptimal or dangerous environments where they face increased predation or mortality from vehicular collisions."" This directly links narrowness and poor quality to the concept of an ecological trap.
Option A is the opposite of what would constitute a trap according to the passage.
Option B is irrelevant to the features that make a corridor a trap.
Option D describes a user of a corridor, not a feature that makes it a trap."
VARC,40,Q7,7,P2_WildlifeCorridors,"The rapid expansion of urban landscapes worldwide presents a formidable challenge to biodiversity, fragmenting natural habitats and isolating wildlife populations. In response, conservationists and urban planners have increasingly championed the concept of urban wildlife corridors – strips of habitat, often linear, designed to connect larger, isolated patches of green space. These corridors aim to facilitate the movement of animals, allowing for genetic exchange between populations, access to diverse resources, and recolonization of empty habitats, thereby mitigating some of the deleterious effects of urbanization. The theoretical underpinnings are sound: by maintaining connectivity, corridors can enhance the viability of metapopulations and bolster the ecological resilience of urban ecosystems.

However, the practical implementation and effectiveness of urban wildlife corridors are fraught with complexities. Designing functional corridors requires careful consideration of the target species, as a path suitable for a raccoon may be entirely inadequate for a deer or a ground-nesting bird. The width, length, vegetation structure, and degree of human disturbance within a corridor are critical variables. Narrow or poorly vegetated corridors may act as ""ecological traps,"" luring animals into suboptimal or dangerous environments where they face increased predation or mortality from vehicular collisions. Furthermore, the ""edge effects"" – alterations in environmental conditions at the boundary of habitats – can be pronounced in linear corridors, potentially negating their benefits for sensitive interior species.

Securing land for corridors in densely populated urban areas is another significant hurdle, often involving intricate negotiations with private landowners and substantial financial investment. Public acceptance and participation are also crucial; corridors that traverse residential areas require community buy-in to minimize human-wildlife conflict and ensure that adjacent land management practices are conducive to wildlife movement. For example, the use of pesticides in nearby gardens or the presence of free-roaming domestic pets can severely compromise a corridor's utility.

Despite these challenges, successful examples of urban wildlife corridors exist, demonstrating tangible benefits for local fauna. Studies have shown increased movement and gene flow for certain species, and corridors can also provide ancillary ecosystem services, such as improved air and water quality, and recreational opportunities for urban dwellers. The key to success often lies in adaptive management – continuously monitoring corridor use by wildlife and adjusting design and management strategies accordingly – and integrating corridor planning into broader regional conservation strategies rather than treating them as standalone solutions. Ultimately, while not a panacea, thoughtfully designed and managed urban wildlife corridors represent a vital tool in the ongoing effort to reconcile urban development with biodiversity conservation.","According to the passage, all of the following are challenges in implementing effective urban wildlife corridors EXCEPT:",the difficulty in acquiring land in urbanized areas.,the need to tailor corridor design to specific target species.,a complete lack of evidence that any corridors have been successful.,the potential for human activities in adjacent areas to undermine corridor function.,A,B,C,D,C,MCQ,RC,RC Passage Genre: Science & Technology,Medium,Supporting Idea / Detail Based,"question_id:Q7, section:VARC, question_type:MCQ, topic:RC, sub_topic:RC Passage Genre: Science & Technology, concept_tested:Supporting Idea / Detail Based, difficulty_level:Medium, is_tita:false, set_id:MockSet1_VARC, unique_mock_id:8f9a0c1b2",False,MockSet1_VARC,Understanding,"The passage explicitly contradicts this in paragraph 4: ""Despite these challenges, successful examples of urban wildlife corridors exist, demonstrating tangible benefits for local fauna. Studies have shown increased movement and gene flow for certain species...""
Option A is mentioned: ""Securing land for corridors in densely populated urban areas is another significant hurdle.""
Option B is mentioned: ""Designing functional corridors requires careful consideration of the target species...""
Option D is mentioned: ""...the use of pesticides in nearby gardens or the presence of free-roaming domestic pets can severely compromise a corridor's utility."""
VARC,40,Q8,8,P2_WildlifeCorridors,"The rapid expansion of urban landscapes worldwide presents a formidable challenge to biodiversity, fragmenting natural habitats and isolating wildlife populations. In response, conservationists and urban planners have increasingly championed the concept of urban wildlife corridors – strips of habitat, often linear, designed to connect larger, isolated patches of green space. These corridors aim to facilitate the movement of animals, allowing for genetic exchange between populations, access to diverse resources, and recolonization of empty habitats, thereby mitigating some of the deleterious effects of urbanization. The theoretical underpinnings are sound: by maintaining connectivity, corridors can enhance the viability of metapopulations and bolster the ecological resilience of urban ecosystems.

However, the practical implementation and effectiveness of urban wildlife corridors are fraught with complexities. Designing functional corridors requires careful consideration of the target species, as a path suitable for a raccoon may be entirely inadequate for a deer or a ground-nesting bird. The width, length, vegetation structure, and degree of human disturbance within a corridor are critical variables. Narrow or poorly vegetated corridors may act as ""ecological traps,"" luring animals into suboptimal or dangerous environments where they face increased predation or mortality from vehicular collisions. Furthermore, the ""edge effects"" – alterations in environmental conditions at the boundary of habitats – can be pronounced in linear corridors, potentially negating their benefits for sensitive interior species.

Securing land for corridors in densely populated urban areas is another significant hurdle, often involving intricate negotiations with private landowners and substantial financial investment. Public acceptance and participation are also crucial; corridors that traverse residential areas require community buy-in to minimize human-wildlife conflict and ensure that adjacent land management practices are conducive to wildlife movement. For example, the use of pesticides in nearby gardens or the presence of free-roaming domestic pets can severely compromise a corridor's utility.

Despite these challenges, successful examples of urban wildlife corridors exist, demonstrating tangible benefits for local fauna. Studies have shown increased movement and gene flow for certain species, and corridors can also provide ancillary ecosystem services, such as improved air and water quality, and recreational opportunities for urban dwellers. The key to success often lies in adaptive management – continuously monitoring corridor use by wildlife and adjusting design and management strategies accordingly – and integrating corridor planning into broader regional conservation strategies rather than treating them as standalone solutions. Ultimately, while not a panacea, thoughtfully designed and managed urban wildlife corridors represent a vital tool in the ongoing effort to reconcile urban development with biodiversity conservation.","Which of the following, if true, would most seriously weaken the author's claim that ""thoughtfully designed and managed urban wildlife corridors represent a vital tool""?","A new study shows that in several major cities, the cost of maintaining wildlife corridors exceeds their measurable economic benefits in terms of ecosystem services.",Research indicates that genetic exchange facilitated by corridors is often insufficient to prevent long-term population decline for many sensitive species.,"Urban planners are increasingly incorporating green infrastructure, including corridors, into new city development plans.",Many communities have successfully established volunteer programs to help maintain and monitor local wildlife corridors.,A,B,C,D,B,MCQ,RC,RC Passage Genre: Science & Technology,Hard,Weaken / Strengthen the Argument,"question_id:Q8, section:VARC, question_type:MCQ, topic:RC, sub_topic:RC Passage Genre: Science & Technology, concept_tested:Weaken / Strengthen the Argument, difficulty_level:Hard, is_tita:false, set_id:MockSet1_VARC, unique_mock_id:8f9a0c1b2",False,MockSet1_VARC,Evaluating,"The author claims corridors are a ""vital tool"" in part because they ""facilitate the movement of animals, allowing for genetic exchange between populations"" (Para 1) and ""studies have shown increased movement and gene flow"" (Para 4). If this genetic exchange is insufficient for long-term viability, it significantly weakens the claim about corridors being a vital tool for conservation success.
Option A focuses on economic cost vs. ecosystem services, which is a concern but doesn't directly attack the core ecological vitality argument as strongly.
Option C strengthens the idea of corridors being accepted and implemented.
Option D highlights community success, which supports the idea of corridors being manageable and beneficial."
VARC,40,Q9,9,P3_CentralBanks,"Central banks, traditionally the staid custodians of monetary stability and financial order, find themselves navigating an era of unprecedented transformation. For decades, their primary mandate revolved around controlling inflation, managing interest rates, and acting as lenders of last resort. This was largely achieved through conventional tools: setting the policy rate, managing reserve requirements for commercial banks, and conducting open market operations. However, the aftermath of the 2008 financial crisis and the subsequent rise of digital technologies have profoundly reshaped the landscape, compelling central banks to innovate and expand their roles, often into uncharted territory.

The prolonged period of low inflation and low interest rates following the 2008 crisis pushed many central banks towards unconventional monetary policies (UMPs), such as quantitative easing (QE) – large-scale asset purchases – and negative interest rates. While these measures were intended to stimulate economies and avert deflation, their long-term efficacy and unintended consequences, such as asset bubbles and increased wealth inequality, remain subjects of intense debate. The sheer scale of these interventions has also significantly expanded central bank balance sheets, raising questions about their future unwinding and the potential for market disruption.

Adding another layer of complexity is the rapid proliferation of digital currencies. Cryptocurrencies like Bitcoin, initially dismissed by many in the financial establishment, have demonstrated the potential of decentralized ledger technology. While their volatility and scalability issues currently limit their use as mainstream currency, they have spurred central banks to explore their own digital currencies (CBDCs). The motivations for CBDCs are varied: enhancing payment efficiency, promoting financial inclusion, countering the rise of private digital currencies, and maintaining monetary sovereignty. However, the design and implementation of CBDCs pose significant challenges, including privacy concerns, cybersecurity risks, and the potential impact on the existing two-tier banking system, where commercial banks play a crucial intermediary role.

Furthermore, central banks are increasingly expected to address broader societal challenges, such as climate change and inequality. Some argue that central banks should incorporate climate-related risks into their financial stability frameworks and use their asset purchase programs to support green investments. Others caution against ""mission creep,"" warning that an overextension of mandates could compromise central bank independence and effectiveness in their core functions. The path forward requires a delicate balancing act: embracing innovation to maintain relevance and effectiveness in a digital world, while prudently managing new risks and preserving public trust in their traditional roles of ensuring monetary and financial stability.",The passage is primarily concerned with:,advocating for the abolition of central banks in favor of decentralized digital currencies.,detailing the mechanisms of conventional monetary policy tools used by central banks.,examining the evolving roles and new challenges facing central banks in the contemporary era.,criticizing central banks for their handling of the 2008 financial crisis and its aftermath.,A,B,C,D,C,MCQ,RC,RC Passage Genre: Economics & Business,Medium,Main Idea / Central Theme / Primary Purpose,"question_id:Q9, section:VARC, question_type:MCQ, topic:RC, sub_topic:RC Passage Genre: Economics & Business, concept_tested:Main Idea / Central Theme / Primary Purpose, difficulty_level:Medium, is_tita:false, set_id:MockSet1_VARC, unique_mock_id:8f9a0c1b2",False,MockSet1_VARC,Analyzing,"The passage starts by describing the traditional role of central banks (Para 1), then discusses how the post-2008 crisis led to UMPs (Para 2), the challenges posed by digital currencies and CBDCs (Para 3), and new expectations regarding societal issues like climate change (Para 4). This clearly shows an examination of evolving roles and new challenges.
Option A is too extreme and not supported; the passage discusses CBDCs as an exploration by central banks themselves.
Option B is too narrow; conventional tools are mentioned as a baseline, but the focus is on new developments.
Option D is a misrepresentation; the passage discusses actions post-2008 but doesn't primarily criticize the handling of the crisis itself."
VARC,40,Q10,10,P3_CentralBanks,"Central banks, traditionally the staid custodians of monetary stability and financial order, find themselves navigating an era of unprecedented transformation. For decades, their primary mandate revolved around controlling inflation, managing interest rates, and acting as lenders of last resort. This was largely achieved through conventional tools: setting the policy rate, managing reserve requirements for commercial banks, and conducting open market operations. However, the aftermath of the 2008 financial crisis and the subsequent rise of digital technologies have profoundly reshaped the landscape, compelling central banks to innovate and expand their roles, often into uncharted territory.

The prolonged period of low inflation and low interest rates following the 2008 crisis pushed many central banks towards unconventional monetary policies (UMPs), such as quantitative easing (QE) – large-scale asset purchases – and negative interest rates. While these measures were intended to stimulate economies and avert deflation, their long-term efficacy and unintended consequences, such as asset bubbles and increased wealth inequality, remain subjects of intense debate. The sheer scale of these interventions has also significantly expanded central bank balance sheets, raising questions about their future unwinding and the potential for market disruption.

Adding another layer of complexity is the rapid proliferation of digital currencies. Cryptocurrencies like Bitcoin, initially dismissed by many in the financial establishment, have demonstrated the potential of decentralized ledger technology. While their volatility and scalability issues currently limit their use as mainstream currency, they have spurred central banks to explore their own digital currencies (CBDCs). The motivations for CBDCs are varied: enhancing payment efficiency, promoting financial inclusion, countering the rise of private digital currencies, and maintaining monetary sovereignty. However, the design and implementation of CBDCs pose significant challenges, including privacy concerns, cybersecurity risks, and the potential impact on the existing two-tier banking system, where commercial banks play a crucial intermediary role.

Furthermore, central banks are increasingly expected to address broader societal challenges, such as climate change and inequality. Some argue that central banks should incorporate climate-related risks into their financial stability frameworks and use their asset purchase programs to support green investments. Others caution against ""mission creep,"" warning that an overextension of mandates could compromise central bank independence and effectiveness in their core functions. The path forward requires a delicate balancing act: embracing innovation to maintain relevance and effectiveness in a digital world, while prudently managing new risks and preserving public trust in their traditional roles of ensuring monetary and financial stability.",It can be inferred from the passage that one of the significant concerns regarding Central Bank Digital Currencies (CBDCs) is their potential to:,completely eliminate the problem of financial exclusion.,increase the volatility and instability of the financial system.,alter the fundamental structure of the current banking system.,be less secure than private cryptocurrencies like Bitcoin.,A,B,C,D,C,MCQ,RC,RC Passage Genre: Economics & Business,Medium,Inference / Implied Meaning,"question_id:Q10, section:VARC, question_type:MCQ, topic:RC, sub_topic:RC Passage Genre: Economics & Business, concept_tested:Inference / Implied Meaning, difficulty_level:Medium, is_tita:false, set_id:MockSet1_VARC, unique_mock_id:8f9a0c1b2",False,MockSet1_VARC,Analyzing,"Paragraph 3 states that CBDCs pose challenges including ""the potential impact on the existing two-tier banking system, where commercial banks play a crucial intermediary role."" This directly points to a structural alteration.
Option A is too optimistic; while CBDCs aim to ""promote financial inclusion,"" eliminating the problem entirely is not stated as a concern or direct outcome.
Option B is not directly stated as a concern with CBDCs; volatility is mentioned in relation to private cryptocurrencies.
Option D is not supported; the passage mentions cybersecurity risks for CBDCs but doesn't compare their security to private cryptocurrencies."
