SectionName,SectionTimeLimitMinutes,QuestionUniqueID,QuestionNumberInSection,PassageOrSetID,PassageOrSetContent,QuestionPrompt,OptionAText,OptionBText,OptionCText,OptionDText,OptionAValue,OptionBValue,OptionCValue,OptionDValue,CorrectAnswerValue,QuestionType,Topic,SubTopic,DifficultyLevelPredicted,ConceptTested,DetailedTags,IsTITA,SetID,CognitiveSkillLevel,SolutionExplanation
VARC,40,ag3h5jLp2_Q12,12,P3_Degrowth,"The concept of ""degrowth"" has emerged as a radical critique of the prevailing global economic paradigm, which equates progress with perpetual economic expansion. Proponents of degrowth argue that infinite growth on a finite planet is a physical impossibility and a socio-ecological disaster. They advocate for a planned and equitable downscaling of production and consumption in high-income nations, leading to a smaller, more sustainable economy that prioritizes human well-being and ecological health over Gross Domestic Product (GDP) accumulation. This is not simply a call for a recession, which is an unplanned and undesirable contraction, but a deliberate societal reorganisation.

The intellectual lineage of degrowth can be traced to earlier critiques of industrial society, such as those by E.F. Schumacher, and to ecological economics, which emphasizes the biophysical limits of economic activity. Degrowth theorists contend that technological efficiency gains, often touted as a solution to environmental problems within a growth framework (so-called ""green growth""), are insufficient to address the scale of the ecological crisis. They point to the Jevons paradox, where increased efficiency in resource use can lead to increased overall consumption of that resource. Thus, they argue, a fundamental shift away from the growth imperative is necessary.

However, the feasibility and desirability of degrowth are subjects of intense debate. Critics, often from mainstream economics, question whether degrowth is politically viable, particularly in societies where economic growth is deeply linked to employment, social welfare, and notions of a better life. How, they ask, can living standards be maintained or improved, especially for the less well-off, in a shrinking economy? There are concerns that degrowth could lead to austerity, social unrest, and a decline in the very resources needed for a transition to a more sustainable society, such as investment in renewable energy.

Degrowth advocates respond by proposing a suite of policies, such as a universal basic income, reduced working hours, wealth redistribution, and a focus on commons-based and localized economies. They argue that well-being is not synonymous with material wealth beyond a certain point, and that a richer life can be found in community, leisure, and ecological connection. Some empirical support comes from studies showing that countries with lower GDP per capita but strong social support systems can achieve high levels of life satisfaction. Nevertheless, the transition to a degrowth society would require a profound cultural shift, challenging deeply ingrained consumerist values and the political structures that uphold the growth paradigm. The debate continues, but degrowth has undeniably pushed the boundaries of economic thought, forcing a re-evaluation of what ""progress"" truly means in the 21st century.",The author of the passage would most likely agree with which of the following statements regarding the debate on degrowth?,"While theoretically appealing, degrowth is practically unrealizable due to entrenched consumerist values and political systems.","Degrowth offers a necessary and urgent alternative to the current economic paradigm, despite its transitional challenges.","The degrowth perspective, though facing valid criticisms, has valuably expanded the discourse on economic progress and sustainability.",Mainstream economics has largely and rightly dismissed degrowth as an unviable and overly pessimistic economic model.,1,2,3,4,3,MCQ,RC,RC Passage Genre: Economics & Business,Medium,Author Agrees/Disagrees,"Degrowth, Economic Debate, Author's Perspective, Sustainability Discourse",False,MockSet1_VARC,Analysis,"The passage presents both the arguments for degrowth and the criticisms against it (Paragraph 3). The concluding sentence explicitly states: ""The debate continues, but degrowth has undeniably pushed the boundaries of economic thought, forcing a re-evaluation of what 'progress' truly means in the 21st century."" This strongly supports option [3].
[1] is too definitive in its dismissal.
[2] is too strong in its endorsement; the author presents it as a debated concept.
[4] contradicts the author's acknowledgment of degrowth's impact on expanding the discourse."
VARC,40,ag3h5jLp2_Q13,13,P4_SapirWhorf,"The Sapir-Whorf hypothesis, in its strongest form, posits that the language one speaks determines the way one thinks and perceives the world. This concept, often termed linguistic determinism, suggests that individuals from different linguistic backgrounds inhabit fundamentally different cognitive realities. Benjamin Lee Whorf, an amateur linguist studying Hopi, famously argued that the Hopi language, lacking tenses and specific words for time as a linear flow, led its speakers to a conception of time radically different from that of speakers of Standard Average European languages. This strong version, however, has faced considerable criticism for its empirical weaknesses and its seemingly deterministic implications, which some feared could lead to a form of linguistic fatalism or an overstatement of cultural incommensurability.

A weaker, and more widely accepted, version of the hypothesis is linguistic relativity. This view does not claim that language *determines* thought but rather that it *influences* it. Differences in linguistic structure and vocabulary may make certain ways of thinking easier or more habitual for speakers of one language compared to another, without entirely precluding other modes of thought. For example, languages that have grammatical gender for inanimate objects might subtly encourage speakers to personify those objects or attribute gendered qualities to them more readily than speakers of languages without such features. Similarly, languages with rich vocabularies for specific domains, like colours or types of snow (as often cited for Inuit languages, though this example itself is debated), may enable finer perceptual discriminations within those domains.

Modern research in cognitive science and psycholinguistics has provided more nuanced insights. Studies have shown, for instance, that speakers of languages that mark spatial relations differently (e.g., using absolute terms like ""north"" versus relative terms like ""left"") may indeed orient themselves and recall spatial arrangements in ways consistent with their linguistic patterns. However, this does not mean they are incapable of understanding or using the alternative frame of reference when prompted or trained. Bilingual individuals, in particular, often demonstrate cognitive flexibility, able to switch between different conceptual frames associated with their respective languages.

Ultimately, the relationship between language and thought is likely a complex, bidirectional one. Language is not merely a passive reflection of pre-existing thought, nor is thought an unyielding prisoner of linguistic structures. Instead, language provides a set of tools and frameworks that shape, guide, and are in turn shaped by human cognition and cultural experience. While the strong deterministic claims of early Whorfianism are largely discounted, the more modest proposal of linguistic relativity continues to inspire research into how the diverse tapestry of human languages influences the equally diverse ways in which humans make sense of their world. The ""prison-house of language"" may be an overstatement, but the ""scaffolding"" it provides for thought is an undeniable aspect of the human condition.",The primary purpose of the passage is to:,advocate for the universal adoption of a single language to overcome cognitive differences.,present a historical overview of the Sapir-Whorf hypothesis and definitively prove its strongest claims.,discuss the evolution and current understanding of the Sapir-Whorf hypothesis concerning language and thought.,critique modern cognitive science for neglecting the profound impact of language on human perception.,1,2,3,4,3,MCQ,RC,RC Passage Genre: Abstract & Philosophical,Medium,Main Idea / Central Theme / Primary Purpose,"Sapir-Whorf Hypothesis, Linguistic Determinism, Linguistic Relativity, Language, Thought, Cognitive Science",False,MockSet1_VARC,Analysis,"The passage begins with the ""strongest form"" of the hypothesis, discusses Whorf's initial arguments, the criticisms faced, the ""weaker, and more widely accepted, version"" (linguistic relativity), and then integrates ""modern research in cognitive science."" It concludes with a nuanced view of the ""complex, bidirectional"" relationship. This progression clearly shows a discussion of the hypothesis's evolution and current understanding.
[1] is incorrect; the passage explores diversity.
[2] is incorrect; it does not aim to prove the strongest claims, but rather to show how they have been modified.
[4] is incorrect; the passage incorporates findings from cognitive science."
VARC,40,ag3h5jLp2_Q14,14,P4_SapirWhorf,"The Sapir-Whorf hypothesis, in its strongest form, posits that the language one speaks determines the way one thinks and perceives the world. This concept, often termed linguistic determinism, suggests that individuals from different linguistic backgrounds inhabit fundamentally different cognitive realities. Benjamin Lee Whorf, an amateur linguist studying Hopi, famously argued that the Hopi language, lacking tenses and specific words for time as a linear flow, led its speakers to a conception of time radically different from that of speakers of Standard Average European languages. This strong version, however, has faced considerable criticism for its empirical weaknesses and its seemingly deterministic implications, which some feared could lead to a form of linguistic fatalism or an overstatement of cultural incommensurability.

A weaker, and more widely accepted, version of the hypothesis is linguistic relativity. This view does not claim that language *determines* thought but rather that it *influences* it. Differences in linguistic structure and vocabulary may make certain ways of thinking easier or more habitual for speakers of one language compared to another, without entirely precluding other modes of thought. For example, languages that have grammatical gender for inanimate objects might subtly encourage speakers to personify those objects or attribute gendered qualities to them more readily than speakers of languages without such features. Similarly, languages with rich vocabularies for specific domains, like colours or types of snow (as often cited for Inuit languages, though this example itself is debated), may enable finer perceptual discriminations within those domains.

Modern research in cognitive science and psycholinguistics has provided more nuanced insights. Studies have shown, for instance, that speakers of languages that mark spatial relations differently (e.g., using absolute terms like ""north"" versus relative terms like ""left"") may indeed orient themselves and recall spatial arrangements in ways consistent with their linguistic patterns. However, this does not mean they are incapable of understanding or using the alternative frame of reference when prompted or trained. Bilingual individuals, in particular, often demonstrate cognitive flexibility, able to switch between different conceptual frames associated with their respective languages.

Ultimately, the relationship between language and thought is likely a complex, bidirectional one. Language is not merely a passive reflection of pre-existing thought, nor is thought an unyielding prisoner of linguistic structures. Instead, language provides a set of tools and frameworks that shape, guide, and are in turn shaped by human cognition and cultural experience. While the strong deterministic claims of early Whorfianism are largely discounted, the more modest proposal of linguistic relativity continues to inspire research into how the diverse tapestry of human languages influences the equally diverse ways in which humans make sense of their world. The ""prison-house of language"" may be an overstatement, but the ""scaffolding"" it provides for thought is an undeniable aspect of the human condition.","According to the passage, the ""strong version"" of the Sapir-Whorf hypothesis was criticized primarily because:",it was based on an inaccurate understanding of the Hopi language's tense system.,its deterministic view of language's power over thought lacked sufficient empirical support and had potentially negative implications.,it failed to account for the cognitive flexibility demonstrated by bilingual individuals.,later research showed that linguistic structures for time and space are largely universal across languages.,1,2,3,4,2,MCQ,RC,RC Passage Genre: Abstract & Philosophical,Easy,Supporting Idea / Detail Based,"Sapir-Whorf Hypothesis, Linguistic Determinism, Criticism, Empirical Weakness, Deterministic Implications",False,MockSet1_VARC,Comprehension,"The first paragraph states: ""This strong version, however, has faced considerable criticism for its empirical weaknesses and its seemingly deterministic implications, which some feared could lead to a form of linguistic fatalism or an overstatement of cultural incommensurability."" This aligns directly with option [2].
[1] is a specific detail about Whorf's study, not the general reason for criticism of the strong hypothesis itself.
[3] is a finding from modern research, not a primary criticism of the initial strong version.
[4] is not mentioned as a primary criticism of the early strong version."
VARC,40,ag3h5jLp2_Q15,15,P4_SapirWhorf,"The Sapir-Whorf hypothesis, in its strongest form, posits that the language one speaks determines the way one thinks and perceives the world. This concept, often termed linguistic determinism, suggests that individuals from different linguistic backgrounds inhabit fundamentally different cognitive realities. Benjamin Lee Whorf, an amateur linguist studying Hopi, famously argued that the Hopi language, lacking tenses and specific words for time as a linear flow, led its speakers to a conception of time radically different from that of speakers of Standard Average European languages. This strong version, however, has faced considerable criticism for its empirical weaknesses and its seemingly deterministic implications, which some feared could lead to a form of linguistic fatalism or an overstatement of cultural incommensurability.

A weaker, and more widely accepted, version of the hypothesis is linguistic relativity. This view does not claim that language *determines* thought but rather that it *influences* it. Differences in linguistic structure and vocabulary may make certain ways of thinking easier or more habitual for speakers of one language compared to another, without entirely precluding other modes of thought. For example, languages that have grammatical gender for inanimate objects might subtly encourage speakers to personify those objects or attribute gendered qualities to them more readily than speakers of languages without such features. Similarly, languages with rich vocabularies for specific domains, like colours or types of snow (as often cited for Inuit languages, though this example itself is debated), may enable finer perceptual discriminations within those domains.

Modern research in cognitive science and psycholinguistics has provided more nuanced insights. Studies have shown, for instance, that speakers of languages that mark spatial relations differently (e.g., using absolute terms like ""north"" versus relative terms like ""left"") may indeed orient themselves and recall spatial arrangements in ways consistent with their linguistic patterns. However, this does not mean they are incapable of understanding or using the alternative frame of reference when prompted or trained. Bilingual individuals, in particular, often demonstrate cognitive flexibility, able to switch between different conceptual frames associated with their respective languages.

Ultimately, the relationship between language and thought is likely a complex, bidirectional one. Language is not merely a passive reflection of pre-existing thought, nor is thought an unyielding prisoner of linguistic structures. Instead, language provides a set of tools and frameworks that shape, guide, and are in turn shaped by human cognition and cultural experience. While the strong deterministic claims of early Whorfianism are largely discounted, the more modest proposal of linguistic relativity continues to inspire research into how the diverse tapestry of human languages influences the equally diverse ways in which humans make sense of their world. The ""prison-house of language"" may be an overstatement, but the ""scaffolding"" it provides for thought is an undeniable aspect of the human condition.",The author mentions languages with grammatical gender and rich vocabularies for specific domains primarily to:,provide definitive proof that language determines thought.,"illustrate how linguistic relativity suggests language can influence, rather than strictly determine, thought patterns.",argue that these linguistic features are unique to non-European languages and lead to superior cognitive abilities.,demonstrate the empirical weaknesses of Whorf's original studies on the Hopi language.,1,2,3,4,2,MCQ,RC,RC Passage Genre: Abstract & Philosophical,Medium,Application / Extrapolation,"Sapir-Whorf Hypothesis, Linguistic Relativity, Grammatical Gender, Vocabulary, Language Influence",False,MockSet1_VARC,Comprehension,"These examples are introduced in the second paragraph, immediately after the definition of linguistic relativity as the view that language *influences* thought. The passage says these features ""might subtly encourage"" or ""may enable finer perceptual discriminations,"" which are examples of influence, not determination.
[1] is incorrect; these support linguistic relativity, not determinism.
[3] is an unsupported generalization.
[4] is not the primary purpose of these examples in the context of explaining linguistic relativity."
VARC,40,ag3h5jLp2_Q16,16,P4_SapirWhorf,"The Sapir-Whorf hypothesis, in its strongest form, posits that the language one speaks determines the way one thinks and perceives the world. This concept, often termed linguistic determinism, suggests that individuals from different linguistic backgrounds inhabit fundamentally different cognitive realities. Benjamin Lee Whorf, an amateur linguist studying Hopi, famously argued that the Hopi language, lacking tenses and specific words for time as a linear flow, led its speakers to a conception of time radically different from that of speakers of Standard Average European languages. This strong version, however, has faced considerable criticism for its empirical weaknesses and its seemingly deterministic implications, which some feared could lead to a form of linguistic fatalism or an overstatement of cultural incommensurability.

A weaker, and more widely accepted, version of the hypothesis is linguistic relativity. This view does not claim that language *determines* thought but rather that it *influences* it. Differences in linguistic structure and vocabulary may make certain ways of thinking easier or more habitual for speakers of one language compared to another, without entirely precluding other modes of thought. For example, languages that have grammatical gender for inanimate objects might subtly encourage speakers to personify those objects or attribute gendered qualities to them more readily than speakers of languages without such features. Similarly, languages with rich vocabularies for specific domains, like colours or types of snow (as often cited for Inuit languages, though this example itself is debated), may enable finer perceptual discriminations within those domains.

Modern research in cognitive science and psycholinguistics has provided more nuanced insights. Studies have shown, for instance, that speakers of languages that mark spatial relations differently (e.g., using absolute terms like ""north"" versus relative terms like ""left"") may indeed orient themselves and recall spatial arrangements in ways consistent with their linguistic patterns. However, this does not mean they are incapable of understanding or using the alternative frame of reference when prompted or trained. Bilingual individuals, in particular, often demonstrate cognitive flexibility, able to switch between different conceptual frames associated with their respective languages.

Ultimately, the relationship between language and thought is likely a complex, bidirectional one. Language is not merely a passive reflection of pre-existing thought, nor is thought an unyielding prisoner of linguistic structures. Instead, language provides a set of tools and frameworks that shape, guide, and are in turn shaped by human cognition and cultural experience. While the strong deterministic claims of early Whorfianism are largely discounted, the more modest proposal of linguistic relativity continues to inspire research into how the diverse tapestry of human languages influences the equally diverse ways in which humans make sense of their world. The ""prison-house of language"" may be an overstatement, but the ""scaffolding"" it provides for thought is an undeniable aspect of the human condition.",Which of the following statements is NOT inconsistent with the author's perspective on the relationship between language and thought as presented in the passage?,"Learning a new language with a different conceptualization of time could lead an individual to perceive time in a new way, alongside their original perception.","All human languages, despite their surface differences, ultimately provide the same fundamental tools for thought.",The cognitive differences observed between speakers of different languages are superficial and do not reflect genuinely different ways of understanding the world.,"Once an individual's thought patterns are established by their native language, they are largely immutable, even with exposure to other languages.",1,2,3,4,1,MCQ,RC,RC Passage Genre: Abstract & Philosophical,Medium,Author Agrees/Disagrees,"Sapir-Whorf Hypothesis, Language and Thought, Linguistic Relativity, Cognitive Flexibility, Author's Perspective",False,MockSet1_VARC,Analysis,"The passage supports linguistic relativity and mentions the ""cognitive flexibility"" of bilinguals who can ""switch between different conceptual frames."" This implies that new linguistic frameworks can offer new ways of perceiving, which can co-exist with or augment existing ones. The passage also refers to language as ""scaffolding"" for thought, implying it shapes and supports but doesn't rigidly imprison.
[2] is too strong; the passage emphasizes how the ""diverse tapestry of human languages influences the equally diverse ways in which humans make sense of their world.""
[3] contradicts the core idea of linguistic relativity, which is that language *does* influence thought in meaningful ways.
[4] contradicts the idea of cognitive flexibility and the bidirectional influence between language and thought."
VARC,40,ag3h5jLp2_Q17,17,VA_OOO_UncannyValley,"1.  The uncanny valley, a concept in aesthetics, describes the unsettling feeling experienced when humanoid replicas closely, but not perfectly, resemble actual human beings.
2.  As AI-generated art becomes more sophisticated, its ability to evoke genuine emotional responses, rather than mere curiosity or unease, will be a key test of its artistic merit.
3.  This revulsion is often attributed to the subtle imperfections that signal the replica is not truly human, triggering a cognitive dissonance.
4.  Early animatronics in theme parks, for instance, often fell into this valley, appearing more eerie than engaging.
5.  The challenge for creators of AI art lies in navigating this valley, aiming for either clear stylization or near-perfect realism to avoid this unsettling effect.","Five jumbled up sentences, related to a topic, are given below. Four of them can be put together to form a coherent paragraph. Identify the odd sentence and key in the number of that sentence as your answer.",,,,,,,,,2,TITA,VA,Odd One Out (Sentence Exclusion),Medium,Coherence & Theme Identification / Direct Application,"Odd One Out, Uncanny Valley, Aesthetics, AI Art, Humanoid Replicas",True,MockSet1_VARC,Analysis,"Sentences 1, 3, 4, and 5 all focus on the ""uncanny valley"" phenomenon. Sentence 1 defines it. Sentence 3 explains the psychological reaction. Sentence 4 provides an example. Sentence 5 discusses how creators of AI art (a specific type of replica) might deal with it.
Sentence 2, ""As AI-generated art becomes more sophisticated, its ability to evoke genuine emotional responses, rather than mere curiosity or unease, will be a key test of its artistic merit,"" shifts the discussion to a broader criterion for evaluating AI art (its ability to evoke genuine emotion) rather than specifically the uncanny valley effect, which is about unease due to imperfect resemblance. While related, sentence 2 introduces a different evaluative framework for AI art beyond just avoiding the uncanny valley."
