SectionName,SectionTimeLimitMinutes,QuestionUniqueID,QuestionNumberInSection,PassageOrSetID,PassageOrSetContent,QuestionPrompt,OptionAText,OptionBText,OptionCText,OptionDText,OptionAValue,OptionBValue,OptionCValue,OptionDValue,CorrectAnswerValue,QuestionType,Topic,SubTopic,DifficultyLevelPredicted,ConceptTested,DetailedTags,IsTITA,SetID,CognitiveSkillLevel,SolutionExplanation
VARC,40,Q1,1,P1_Mimesis,"The concept of mimesis, often translated as ""imitation"" or ""representation,"" has been a cornerstone of Western aesthetic theory since antiquity, though its interpretation and valuation have fluctuated dramatically. Plato, in his Republic, famously critiqued mimesis in art, particularly poetry and painting, arguing that it was thrice removed from reality – a mere copy of a copy of the ideal Forms. For him, art that imitated the sensible world could only lead the soul further away from truth and understanding. He viewed mimetic artists as purveyors of illusion, potentially corrupting the citizenry by appealing to lower, irrational parts of the soul. This Platonic distrust set a precedent for suspicion towards representational art that would echo through centuries.

Aristotle, Plato’s student, offered a more nuanced and affirmative perspective in his Poetics. While agreeing that art is a form of imitation, Aristotle saw mimesis not as a passive copying but as a creative act that could reveal universal truths about human nature and action. For him, tragedy, through the mimesis of action, could evoke pity and fear, leading to catharsis – a purgation of these emotions that was ultimately beneficial. Aristotle emphasized that artists imitate ""men in action,"" and that this imitation could represent things as they were, as they are said or thought to be, or as they ought to be. This broadened the scope of mimesis beyond mere replication, imbuing it with cognitive and ethical value. He saw the human instinct for imitation as natural and a source of learning and pleasure.

The Renaissance witnessed a resurgence of classical ideals, and mimesis was central to its artistic and literary theories, often interpreted as the faithful representation of nature and human life. However, the rise of Romanticism in the late 18th and 19th centuries challenged this view, emphasizing instead the artist's originality, emotional expression, and imagination as the sources of artistic value. The focus shifted from the outward world to the inner world of the artist.

In the 20th and 21st centuries, theories of mimesis have become even more complex, influenced by structuralism, post-structuralism, and psychoanalysis. Thinkers like Erich Auerbach, in his seminal work *Mimesis: The Representation of Reality in Western Literature*, traced the diverse ways reality has been represented from Homer to modernism. Post-structuralist critics, on the other hand, have often deconstructed the very notion of a stable ""reality"" that can be represented, arguing that all representation is mediated by language and cultural codes, and thus mimesis is less about reflecting an external truth and more about constructing realities. Today, mimesis is understood not as a monolithic concept but as a dynamic process of engagement with, and transformation of, the world through artistic and cultural practices. It navigates the complex interplay between representation, reality, interpretation, and the very construction of meaning.",What is the primary purpose of the passage?,To argue for the superiority of Aristotle's view of mimesis over Plato's.,To trace the historical evolution and changing interpretations of the concept of mimesis in Western thought.,To critique the modern understanding of mimesis as overly complex and detached from its original meaning.,To explain how mimesis has consistently been understood as the faithful representation of reality.,A,B,C,D,B,MCQ,RC,RC Passage Genre: Humanities & Social Sciences,Medium,Main Idea / Central Theme / Primary Purpose,"question_id:Q1, section:VARC, question_type:MCQ, topic:RC, sub_topic:RC Passage Genre: Humanities & Social Sciences, concept_tested:Main Idea / Central Theme / Primary Purpose, difficulty_level:Medium, is_tita:false, set_id:MockSet1_VARC, unique_mock_id:8f9a0c1b2",False,MockSet1_VARC,Analyzing,"The passage begins by introducing mimesis and then moves chronologically through Plato, Aristotle, the Renaissance, Romanticism, and modern theories (20th-21st centuries), detailing how the understanding and valuation of mimesis have changed.
Option A is too narrow; while it discusses Plato and Aristotle, it's not the sole purpose.
Option C is incorrect; the author doesn't critique modern understanding as ""overly complex"" but rather describes its complexity.
Option D is incorrect as the passage explicitly states interpretations have ""fluctuated dramatically."""
VARC,40,Q2,2,P1_Mimesis,"The concept of mimesis, often translated as ""imitation"" or ""representation,"" has been a cornerstone of Western aesthetic theory since antiquity, though its interpretation and valuation have fluctuated dramatically. Plato, in his Republic, famously critiqued mimesis in art, particularly poetry and painting, arguing that it was thrice removed from reality – a mere copy of a copy of the ideal Forms. For him, art that imitated the sensible world could only lead the soul further away from truth and understanding. He viewed mimetic artists as purveyors of illusion, potentially corrupting the citizenry by appealing to lower, irrational parts of the soul. This Platonic distrust set a precedent for suspicion towards representational art that would echo through centuries.

Aristotle, Plato’s student, offered a more nuanced and affirmative perspective in his Poetics. While agreeing that art is a form of imitation, Aristotle saw mimesis not as a passive copying but as a creative act that could reveal universal truths about human nature and action. For him, tragedy, through the mimesis of action, could evoke pity and fear, leading to catharsis – a purgation of these emotions that was ultimately beneficial. Aristotle emphasized that artists imitate ""men in action,"" and that this imitation could represent things as they were, as they are said or thought to be, or as they ought to be. This broadened the scope of mimesis beyond mere replication, imbuing it with cognitive and ethical value. He saw the human instinct for imitation as natural and a source of learning and pleasure.

The Renaissance witnessed a resurgence of classical ideals, and mimesis was central to its artistic and literary theories, often interpreted as the faithful representation of nature and human life. However, the rise of Romanticism in the late 18th and 19th centuries challenged this view, emphasizing instead the artist's originality, emotional expression, and imagination as the sources of artistic value. The focus shifted from the outward world to the inner world of the artist.

In the 20th and 21st centuries, theories of mimesis have become even more complex, influenced by structuralism, post-structuralism, and psychoanalysis. Thinkers like Erich Auerbach, in his seminal work *Mimesis: The Representation of Reality in Western Literature*, traced the diverse ways reality has been represented from Homer to modernism. Post-structuralist critics, on the other hand, have often deconstructed the very notion of a stable ""reality"" that can be represented, arguing that all representation is mediated by language and cultural codes, and thus mimesis is less about reflecting an external truth and more about constructing realities. Today, mimesis is understood not as a monolithic concept but as a dynamic process of engagement with, and transformation of, the world through artistic and cultural practices. It navigates the complex interplay between representation, reality, interpretation, and the very construction of meaning.",It can be inferred from the passage that Aristotle's view of mimesis differed from Plato's primarily in that Aristotle believed:,mimesis was inherently deceptive and harmful to society.,mimesis could be a creative and insightful act with cognitive value.,artists should only imitate ideal Forms rather than the sensible world.,"the primary function of art was to provide pleasure, not learning.",A,B,C,D,B,MCQ,RC,RC Passage Genre: Humanities & Social Sciences,Medium,Inference / Implied Meaning,"question_id:Q2, section:VARC, question_type:MCQ, topic:RC, sub_topic:RC Passage Genre: Humanities & Social Sciences, concept_tested:Inference / Implied Meaning, difficulty_level:Medium, is_tita:false, set_id:MockSet1_VARC, unique_mock_id:8f9a0c1b2",False,MockSet1_VARC,Analyzing,"The passage states, ""Aristotle saw mimesis not as a passive copying but as a creative act that could reveal universal truths about human nature and action... imbuing it with cognitive and ethical value."" This contrasts with Plato's view of mimesis as ""thrice removed from reality"" and leading away from truth.
Option A reflects Plato's view, not Aristotle's differing point.
Option C is a Platonic idea (ideal Forms), not Aristotle's distinction.
Option D is partially true (Aristotle saw it as a source of pleasure) but misses the key cognitive/learning aspect that differentiated his view from Plato's primarily negative one."
VARC,40,Q3,3,P1_Mimesis,"The concept of mimesis, often translated as ""imitation"" or ""representation,"" has been a cornerstone of Western aesthetic theory since antiquity, though its interpretation and valuation have fluctuated dramatically. Plato, in his Republic, famously critiqued mimesis in art, particularly poetry and painting, arguing that it was thrice removed from reality – a mere copy of a copy of the ideal Forms. For him, art that imitated the sensible world could only lead the soul further away from truth and understanding. He viewed mimetic artists as purveyors of illusion, potentially corrupting the citizenry by appealing to lower, irrational parts of the soul. This Platonic distrust set a precedent for suspicion towards representational art that would echo through centuries.

Aristotle, Plato’s student, offered a more nuanced and affirmative perspective in his Poetics. While agreeing that art is a form of imitation, Aristotle saw mimesis not as a passive copying but as a creative act that could reveal universal truths about human nature and action. For him, tragedy, through the mimesis of action, could evoke pity and fear, leading to catharsis – a purgation of these emotions that was ultimately beneficial. Aristotle emphasized that artists imitate ""men in action,"" and that this imitation could represent things as they were, as they are said or thought to be, or as they ought to be. This broadened the scope of mimesis beyond mere replication, imbuing it with cognitive and ethical value. He saw the human instinct for imitation as natural and a source of learning and pleasure.

The Renaissance witnessed a resurgence of classical ideals, and mimesis was central to its artistic and literary theories, often interpreted as the faithful representation of nature and human life. However, the rise of Romanticism in the late 18th and 19th centuries challenged this view, emphasizing instead the artist's originality, emotional expression, and imagination as the sources of artistic value. The focus shifted from the outward world to the inner world of the artist.

In the 20th and 21st centuries, theories of mimesis have become even more complex, influenced by structuralism, post-structuralism, and psychoanalysis. Thinkers like Erich Auerbach, in his seminal work *Mimesis: The Representation of Reality in Western Literature*, traced the diverse ways reality has been represented from Homer to modernism. Post-structuralist critics, on the other hand, have often deconstructed the very notion of a stable ""reality"" that can be represented, arguing that all representation is mediated by language and cultural codes, and thus mimesis is less about reflecting an external truth and more about constructing realities. Today, mimesis is understood not as a monolithic concept but as a dynamic process of engagement with, and transformation of, the world through artistic and cultural practices. It navigates the complex interplay between representation, reality, interpretation, and the very construction of meaning.","According to the passage, how is mimesis generally understood in contemporary (20th and 21st century) thought?","As a simple, faithful replication of an objective external reality.",Primarily through the lens of Romantic emphasis on individual artistic genius.,"As a complex, dynamic process of constructing meaning, mediated by cultural codes and language.",As a concept largely abandoned by modern critics in favor of originality.,A,B,C,D,C,MCQ,RC,RC Passage Genre: Humanities & Social Sciences,Medium,Supporting Idea / Detail Based,"question_id:Q3, section:VARC, question_type:MCQ, topic:RC, sub_topic:RC Passage Genre: Humanities & Social Sciences, concept_tested:Supporting Idea / Detail Based, difficulty_level:Medium, is_tita:false, set_id:MockSet1_VARC, unique_mock_id:8f9a0c1b2",False,MockSet1_VARC,Understanding,"The last paragraph states, ""Today, mimesis is understood not as a monolithic concept but as a dynamic process... Post-structuralist critics... arguing that all representation is mediated by language and cultural codes, and thus mimesis is less about reflecting an external truth and more about constructing realities.""
Option A describes an older, simpler view, not the contemporary one.
Option B refers to Romanticism, which is not the dominant contemporary understanding described.
Option D is incorrect; the passage shows it's still a subject of complex theories, not abandoned."
VARC,40,Q4,4,P1_Mimesis,"The concept of mimesis, often translated as ""imitation"" or ""representation,"" has been a cornerstone of Western aesthetic theory since antiquity, though its interpretation and valuation have fluctuated dramatically. Plato, in his Republic, famously critiqued mimesis in art, particularly poetry and painting, arguing that it was thrice removed from reality – a mere copy of a copy of the ideal Forms. For him, art that imitated the sensible world could only lead the soul further away from truth and understanding. He viewed mimetic artists as purveyors of illusion, potentially corrupting the citizenry by appealing to lower, irrational parts of the soul. This Platonic distrust set a precedent for suspicion towards representational art that would echo through centuries.

Aristotle, Plato’s student, offered a more nuanced and affirmative perspective in his Poetics. While agreeing that art is a form of imitation, Aristotle saw mimesis not as a passive copying but as a creative act that could reveal universal truths about human nature and action. For him, tragedy, through the mimesis of action, could evoke pity and fear, leading to catharsis – a purgation of these emotions that was ultimately beneficial. Aristotle emphasized that artists imitate ""men in action,"" and that this imitation could represent things as they were, as they are said or thought to be, or as they ought to be. This broadened the scope of mimesis beyond mere replication, imbuing it with cognitive and ethical value. He saw the human instinct for imitation as natural and a source of learning and pleasure.

The Renaissance witnessed a resurgence of classical ideals, and mimesis was central to its artistic and literary theories, often interpreted as the faithful representation of nature and human life. However, the rise of Romanticism in the late 18th and 19th centuries challenged this view, emphasizing instead the artist's originality, emotional expression, and imagination as the sources of artistic value. The focus shifted from the outward world to the inner world of the artist.

In the 20th and 21st centuries, theories of mimesis have become even more complex, influenced by structuralism, post-structuralism, and psychoanalysis. Thinkers like Erich Auerbach, in his seminal work *Mimesis: The Representation of Reality in Western Literature*, traced the diverse ways reality has been represented from Homer to modernism. Post-structuralist critics, on the other hand, have often deconstructed the very notion of a stable ""reality"" that can be represented, arguing that all representation is mediated by language and cultural codes, and thus mimesis is less about reflecting an external truth and more about constructing realities. Today, mimesis is understood not as a monolithic concept but as a dynamic process of engagement with, and transformation of, the world through artistic and cultural practices. It navigates the complex interplay between representation, reality, interpretation, and the very construction of meaning.","The author's attitude towards the concept of mimesis, as discussed throughout its historical evolution, can best be described as:",dismissive of its relevance in contemporary art theory.,"critical of its earlier, simpler interpretations.","neutral and objective, merely cataloging different views.","analytical and elucidatory, explaining its complex development.",A,B,C,D,D,MCQ,RC,RC Passage Genre: Humanities & Social Sciences,Hard,Tone / Attitude of the Author,"question_id:Q4, section:VARC, question_type:MCQ, topic:RC, sub_topic:RC Passage Genre: Humanities & Social Sciences, concept_tested:Tone / Attitude of the Author, difficulty_level:Hard, is_tita:false, set_id:MockSet1_VARC, unique_mock_id:8f9a0c1b2",False,MockSet1_VARC,Analyzing,"The author systematically presents different historical interpretations of mimesis, explains the shifts in understanding, and clarifies the nuances of each perspective (e.g., Plato vs. Aristotle, Romanticism, post-structuralism). The tone is informative and aims to clarify a complex concept's evolution.
Option A is incorrect; the passage implies its continued relevance through discussion of 20th and 21st-century theories.
Option B is too strong; the author describes earlier interpretations rather than overtly criticizing them as ""simpler"" in a pejorative way.
Option C (""neutral and objective, merely cataloging"") is too passive; the author actively explains and clarifies, which is more than just cataloging."
VARC,40,Q5,5,P2_WildlifeCorridors,"The rapid expansion of urban landscapes worldwide presents a formidable challenge to biodiversity, fragmenting natural habitats and isolating wildlife populations. In response, conservationists and urban planners have increasingly championed the concept of urban wildlife corridors – strips of habitat, often linear, designed to connect larger, isolated patches of green space. These corridors aim to facilitate the movement of animals, allowing for genetic exchange between populations, access to diverse resources, and recolonization of empty habitats, thereby mitigating some of the deleterious effects of urbanization. The theoretical underpinnings are sound: by maintaining connectivity, corridors can enhance the viability of metapopulations and bolster the ecological resilience of urban ecosystems.

However, the practical implementation and effectiveness of urban wildlife corridors are fraught with complexities. Designing functional corridors requires careful consideration of the target species, as a path suitable for a raccoon may be entirely inadequate for a deer or a ground-nesting bird. The width, length, vegetation structure, and degree of human disturbance within a corridor are critical variables. Narrow or poorly vegetated corridors may act as ""ecological traps,"" luring animals into suboptimal or dangerous environments where they face increased predation or mortality from vehicular collisions. Furthermore, the ""edge effects"" – alterations in environmental conditions at the boundary of habitats – can be pronounced in linear corridors, potentially negating their benefits for sensitive interior species.

Securing land for corridors in densely populated urban areas is another significant hurdle, often involving intricate negotiations with private landowners and substantial financial investment. Public acceptance and participation are also crucial; corridors that traverse residential areas require community buy-in to minimize human-wildlife conflict and ensure that adjacent land management practices are conducive to wildlife movement. For example, the use of pesticides in nearby gardens or the presence of free-roaming domestic pets can severely compromise a corridor's utility.

Despite these challenges, successful examples of urban wildlife corridors exist, demonstrating tangible benefits for local fauna. Studies have shown increased movement and gene flow for certain species, and corridors can also provide ancillary ecosystem services, such as improved air and water quality, and recreational opportunities for urban dwellers. The key to success often lies in adaptive management – continuously monitoring corridor use by wildlife and adjusting design and management strategies accordingly – and integrating corridor planning into broader regional conservation strategies rather than treating them as standalone solutions. Ultimately, while not a panacea, thoughtfully designed and managed urban wildlife corridors represent a vital tool in the ongoing effort to reconcile urban development with biodiversity conservation.",What is the primary purpose of this passage?,To advocate for the immediate and widespread implementation of urban wildlife corridors.,To critically evaluate the challenges and benefits of urban wildlife corridors as a conservation tool.,To describe the specific design features required for successful urban wildlife corridors.,To compare the effectiveness of urban wildlife corridors with other conservation strategies.,A,B,C,D,B,MCQ,RC,RC Passage Genre: Science & Technology,Medium,Main Idea / Central Theme / Primary Purpose,"question_id:Q5, section:VARC, question_type:MCQ, topic:RC, sub_topic:RC Passage Genre: Science & Technology, concept_tested:Main Idea / Central Theme / Primary Purpose, difficulty_level:Medium, is_tita:false, set_id:MockSet1_VARC, unique_mock_id:8f9a0c1b2",False,MockSet1_VARC,Analyzing,"The passage introduces urban wildlife corridors as a response to habitat fragmentation (Para 1), then details the ""complexities"" and ""hurdles"" in their implementation (Paras 2 & 3), and finally discusses ""successful examples"" and ""tangible benefits"" while acknowledging they are ""not a panacea"" (Para 4). This balanced discussion of pros and cons points to a critical evaluation.
Option A is too strong; the passage highlights significant challenges and is not an unqualified advocacy.
Option C is too narrow; while design is mentioned, it's not the primary focus.
Option D is not supported; the passage doesn't systematically compare corridors to other strategies."
