SectionName,SectionTimeLimitMinutes,QuestionUniqueID,QuestionNumberInSection,PassageOrSetID,PassageOrSetContent,QuestionPrompt,OptionAText,OptionBText,OptionCText,OptionDText,OptionAValue,OptionBValue,OptionCValue,OptionDValue,CorrectAnswerValue,QuestionType,Topic,SubTopic,DifficultyLevelPredicted,ConceptTested,DetailedTags,IsTITA,SetID,CognitiveSkillLevel,SolutionExplanation
VARC,40,ag3h5jLp2_Q18,18,VA_OOO_Library,"1.  For centuries, the grand library, with its hushed halls and towering shelves, symbolized the pinnacle of knowledge and learning.
2.  Digital archives and online databases now offer unprecedented access to information, challenging the library's traditional role as the primary repository of texts.
3.  This transformation necessitates a re-imagining of the public library, not just as a storehouse of books, but as a dynamic community hub for learning, creation, and connection.
4.  Despite these changes, the physical presence of books continues to hold a certain allure for many readers, offering a tactile and focused experience distinct from screen-based reading.
5.  However, the digital age has profoundly altered the landscape of information access and consumption.","Five jumbled up sentences, related to a topic, are given below. Four of them can be put together to form a coherent paragraph. Identify the odd sentence and key in the number of that sentence as your answer.",,,,,,,,,4,TITA,VA,Odd One Out (Sentence Exclusion),Medium,Coherence & Theme Identification / Direct Application,"Odd One Out, Public Library, Digital Age, Information Access, Role of Libraries",True,MockSet1_VARC,Analysis,"Sentences 1, 5, 2, and 3 form a coherent paragraph. Sentence 1 sets the historical context of the library as a symbol of knowledge. Sentence 5 introduces a shift: ""However, the digital age has profoundly altered..."" Sentence 2 elaborates on this alteration, mentioning digital archives and online databases. Sentence 3 concludes by suggesting a necessary re-imagining of the library's role due to these changes.
Sentence 4, ""Despite these changes, the physical presence of books continues to hold a certain allure for many readers, offering a tactile and focused experience distinct from screen-based reading,"" is an observation about the enduring appeal of physical books. While relevant to the broader topic of reading and libraries, it digresses from the specific logical flow about the *changing role and function* of the library in the digital age that the other sentences establish."
VARC,40,ag3h5jLp2_Q19,19,VA_PS_FlowState,"The concept of ""flow state,"" popularized by psychologist Mihály Csíkszentmihályi, refers to a mental state of complete immersion and energized focus in an activity. Individuals in flow often report a sense of timelessness, a merging of action and awareness, and a feeling of intrinsic reward from the activity itself. This state is typically achieved when the challenge of the task is optimally matched with the individual's skill level, pushing them slightly beyond their comfort zone without causing undue anxiety or boredom. Achieving flow is not just about productivity; it's deeply connected to happiness and a sense of a life well-lived.",The passage given below is followed by four alternate summaries. Choose the option that best captures the essence of the passage.,"Flow state is an optimal psychological condition characterized by deep engagement and enjoyment in an activity, occurring when challenges and skills are well-balanced.","The primary benefit of achieving a flow state, as described by Mihály Csíkszentmihályi, is a significant increase in productivity and task completion.","Achieving flow requires individuals to undertake tasks that are significantly beyond their current skill level, leading to rapid personal growth.","Timelessness and intrinsic reward are the only two indicators of a flow state, which is mainly experienced by highly skilled professionals.",1,2,3,4,1,MCQ,VA,Para Summary (Essence of the Paragraph),Easy,Main Idea Identification / Direct Application,"Para Summary, Flow State, Mihaly Csikszentmihalyi, Psychology, Optimal Experience",False,MockSet1_VARC,Comprehension,"This option accurately captures the main elements: ""complete immersion and energized focus"" (deep engagement), ""intrinsic reward"" (enjoyment), and ""challenge...optimally matched with...skill level"" (well-balanced).
[2] overemphasizes productivity; the passage also links flow to happiness and a life well-lived.
[3] misrepresents the condition for flow; challenges should be optimally matched, not significantly beyond skills, which would cause anxiety.
[4] incorrectly limits the indicators to only two and wrongly suggests it's mainly for highly skilled professionals; the passage implies it's a broader human experience."
VARC,40,ag3h5jLp2_Q20,20,VA_PS_HistoricalInterpretation,"Historical interpretation is not merely a recounting of past events; it is an active process of construction. Historians select, arrange, and interpret evidence based on their perspectives, theoretical frameworks, and the questions they seek to answer. The ""past"" itself is inert; it is the historian who gives it voice and meaning. This does not imply that all interpretations are equally valid, as rigorous historical methodology demands adherence to evidence and logical coherence. However, it does mean that history is a continuous dialogue between the present and the past, constantly being re-evaluated and re-written as new evidence emerges and new perspectives are brought to bear.",The passage given below is followed by four alternate summaries. Choose the option that best captures the essence of the passage.,The most accurate historical interpretations are those that strictly adhere to a chronological recounting of events without any subjective input from the historian.,"History is a dynamic and constructed discipline where historians actively interpret evidence to give meaning to the past, leading to ongoing re-evaluation.","The validity of historical interpretation depends solely on the discovery of new evidence, as the historian's perspective plays a minimal role.","Modern historians have largely abandoned the idea of objective historical truth, accepting that all historical accounts are equally biased and speculative.",1,2,3,4,2,MCQ,VA,Para Summary (Essence of the Paragraph),Medium,Main Idea Identification / Direct Application,"Para Summary, Historical Interpretation, Historiography, Construction of History, Evidence",False,MockSet1_VARC,Comprehension,"The paragraph emphasizes that history is an ""active process of construction,"" where historians ""select, arrange, and interpret evidence."" It explicitly states that ""history is a continuous dialogue between the present and the past, constantly being re-evaluated and re-written."" This aligns perfectly with option [2].
[1] contradicts the passage's core argument about interpretation.
[3] downplays the historian's perspective, which the passage states is crucial in giving the past ""voice and meaning.""
[4] is too extreme; while acknowledging interpretation, the passage also mentions ""rigorous historical methodology demands adherence to evidence and logical coherence,"" implying not all accounts are equally valid or purely biased."
VARC,40,ag3h5jLp2_Q21,21,VA_PC_RenewableEnergy,"The transition to a renewable energy-based economy is a monumental undertaking, far exceeding the simple installation of solar panels and wind turbines. ____(1)____. One of the most significant hurdles is the intermittency of many renewable sources; solar power is unavailable at night, and wind power fluctuates with weather patterns. ____(2)____. Integrating these variable sources into existing power grids, designed for consistent fossil fuel inputs, presents substantial engineering and logistical challenges. ____(3)____. Furthermore, the geographical distribution of renewable resources often does not align with population centers, requiring extensive new transmission networks. ____(4)____. Without these, the dream of a fully renewable energy future remains a distant prospect.","There is a sentence that is missing in the paragraph below. Look at the paragraph and decide in which blank (option 1, 2, 3, or 4) the following sentence would best fit.
Sentence: This necessitates not only technological innovation but also significant policy reforms and public investment in grid infrastructure and storage solutions.",Option 1,Option 2,Option 3,Option 4,1,2,3,4,2,MCQ,VA,Para Completion (Fill in the Blank / Last Sentence),Medium,Contextual Fit & Logical Extension / Direct Application,"Sentence Placement, Renewable Energy, Grid Infrastructure, Policy Reforms, Logical Flow",False,MockSet1_VARC,Analysis,"The paragraph discusses the hurdles in transitioning to renewable energy. The sentence ""One of the most significant hurdles is the intermittency..."" introduces a major problem. The given sentence, ""This necessitates not only technological innovation but also significant policy reforms and public investment in grid infrastructure and storage solutions,"" outlines the broad categories of solutions required to address such a hurdle. It logically fits after the problem of intermittency is stated (end of the first part of sentence 2 in the original prompt, before the blank labelled (2)) and before the subsequent sentence which delves into a specific aspect of that problem: ""Integrating these variable sources into existing power grids...""
The most logical flow is: Problem (intermittency) -> Broad categories of solutions needed for such problems (the given sentence) -> Specific challenge related to the problem (integration)."
VARC,40,ag3h5jLp2_Q22,22,VA_PC_CognitiveBiases,"Cognitive biases are systematic patterns of deviation from norm or rationality in judgment. ____(1)____. They are often studied in psychology and behavioral economics. Although many of these biases are unconscious, they can profoundly impact decision-making in various domains, from personal finance to corporate strategy. ____(2)____. Understanding these biases is the first step towards mitigating their influence. ____(3)____. Strategies such as seeking diverse perspectives, employing structured decision-making processes, and fostering a culture of critical self-reflection can help counteract these inherent tendencies of human thought. ____(4)____. Therefore, awareness and deliberate effort are crucial for more rational and effective decision-making.","There is a sentence that is missing in the paragraph below. Look at the paragraph and decide in which blank (option 1, 2, 3, or 4) the following sentence would best fit.
Sentence: For instance, the availability heuristic might lead a manager to overvalue recent successes when evaluating an employee, neglecting a longer-term pattern of performance.",Option 1,Option 2,Option 3,Option 4,1,2,3,4,2,MCQ,VA,Para Completion (Fill in the Blank / Last Sentence),Medium,Contextual Fit & Logical Extension / Direct Application,"Sentence Placement, Cognitive Biases, Availability Heuristic, Decision-Making, Logical Flow",False,MockSet1_VARC,Analysis,"The sentence ""For instance, the availability heuristic might lead a manager to overvalue recent successes when evaluating an employee, neglecting a longer-term pattern of performance"" is a specific example illustrating how cognitive biases can impact decision-making.
Blank (1) is too early; the general nature of cognitive biases and their study is still being introduced.
Blank (2) is the most suitable position. The preceding sentence states, ""Although many of these biases are unconscious, they can profoundly impact decision-making in various domains, from personal finance to corporate strategy."" The given sentence provides a concrete example of such an impact in a corporate strategy/management context. The sentence following blank (2), ""Understanding these biases is the first step towards mitigating their influence,"" then logically transitions from understanding the impact (illustrated by the example) to addressing it.
Blanks (3) and (4) are in the section discussing solutions and mitigation strategies, making the placement of an example of the problem less coherent."
VARC,40,ag3h5jLp2_Q23,23,VA_PJ_DigitalAgeInfo,"1.  This deluge often leads to information overload, making it difficult to discern credible sources from misinformation.
2.  The digital age has democratized information access, with social media platforms becoming primary news sources for many.
3.  Consequently, critical media literacy skills are more essential than ever for navigating this complex information ecosystem.
4.  However, the algorithms that curate these platforms frequently prioritize engagement over accuracy, creating echo chambers and filter bubbles.","The four sentences (labelled 1, 2, 3 and 4) below, when properly sequenced, would yield a coherent paragraph. Decide on the proper sequencing of the order of the sentences and key in the sequence of the four numbers as your answer.",,,,,,,,,2413,TITA,VA,Para Jumbles (Sentence Rearrangement),Medium,Coherence & Logical Flow / Direct Application,"Para Jumbles, Sentence Sequencing, Digital Age, Social Media, Information Overload, Media Literacy",True,MockSet1_VARC,Analysis,"Sentence 2 introduces the broad topic: the digital age democratizing information access through social media.
Sentence 4 presents a significant caveat or problem associated with this: algorithms on these platforms create echo chambers. ""However"" signals this contrast.
Sentence 1 describes a direct consequence of the problem mentioned in 4: information overload and difficulty discerning truth. ""This deluge"" refers to the information filtered through algorithms.
Sentence 3 offers a conclusion or a necessary response to the situation described: the increased importance of critical media literacy. ""Consequently"" signals this conclusion."
VARC,40,ag3h5jLp2_Q24,24,VA_PJ_Biodiversity,"1.  This focus is crucial, as biodiversity loss is accelerating at an alarming rate globally.
2.  Effective conservation strategies, therefore, must address these underlying drivers, not just the symptoms.
3.  Climate change significantly impacts biodiversity by altering habitats, affecting species distribution, and increasing the frequency of extreme weather events.
4.  The primary drivers of this crisis are multifaceted, including habitat destruction, pollution, overexploitation of resources, and the spread of invasive species, all exacerbated by climate change.","The four sentences (labelled 1, 2, 3 and 4) below, when properly sequenced, would yield a coherent paragraph. Decide on the proper sequencing of the order of the sentences and key in the sequence of the four numbers as your answer.",,,,,,,,,3142,TITA,VA,Para Jumbles (Sentence Rearrangement),Medium,Coherence & Logical Flow / Direct Application,"Para Jumbles, Sentence Sequencing, Biodiversity Loss, Climate Change, Conservation Strategies",True,MockSet1_VARC,Analysis,"Sentence 3 makes a broad opening statement: ""Climate change significantly impacts biodiversity...""
Sentence 1 builds on this by stating a crucial aspect of this impact: ""This focus is crucial, as biodiversity loss is accelerating at an alarming rate globally."" ""This focus"" refers to the impact of climate change on biodiversity mentioned in 3.
Sentence 4 then delves into the ""primary drivers of this crisis"" (the biodiversity crisis made urgent by climate change), listing several factors including those mentioned or implied by sentence 3 and 1.
Sentence 2 concludes by stating that conservation strategies must address these ""underlying drivers"" detailed in sentence 4."
